video_id,title,duration_seconds,days_since_upload,views,likes,comments,channel_title,subscribers
2sCmWmOGqMY,F1 Formula Racing in Virtual reality - Grand Prix Race Highlights 3D VR SBS HTC Vive,369,3007,2235124,10730,98,VR World,17200
0nKvq57G4zU,Playing The BANNED Spider-Man VR Game,667,138,438809,5113,176,Nathie,794000
dKWkHsuaNS8,I Became a Night Club SECURITY GUARD.. (VR),1209,235,4579273,28587,1985,Caylus  ,19600000
G70yE0AEAcI,PC VR IS REALLY CHEAP RIGHT NOW (MAYBE?),658,13,39708,2523,371,MadmanEpic,17700
Nl-ly1osxTc,100 Ways To DESTROY TEACHER (VR School),896,1318,11421954,191993,1431,ProjectJamesify,5120000
e1SblwZzV9Y,Helping George ESCAPE The Zoo? - I Am Monkey VR (New Game),614,5,131753,1298,142,VR Central,389000
nyJUza39ELE,What Virtual Reality Is Like For Someone Who Doesn't Play Games,1107,1825,985747,58459,2709,Razbuten,900000
MlM3F5vs370,"Top 15 Open-world VR Games You Should Play In 2025! For Meta Quest 3, PSVR 2 & PCVR",1489,125,100177,1214,84,Retro Pocket,47200
ALrzu5DRf-c,Best VR Fails & Wins (2022),306,1169,2009179,14898,799,Smart Glasses Hub,5470
rsXAAABqq8M,Playing HELLDIVERS 2 in Virtual Reality - Bonelab VR Mods,608,543,987899,7987,162,Fudgy,4160000
KZScGAAGfRM,RDC PLAYS HORROR VR GAMES (Devour + Yokai Hunters + Phasmophobia),7666,0,103656,4522,299,RDC Live,602000
qq1dTbrG264,360° Dinosaur Roller Coaster Ride 2 – Epic VR Jurassic World Adventure,211,111,735677,1807,26,Player One 360,68200
oL--PU39Xio,Marvel's Deadpool VR - Official Reveal Trailer | Summer Game Fest 2025,84,135,733569,18353,1684,IGN,19400000
1YMCOd5NLOA,I Spent an Entire NFL Season in VR Football,3944,560,1180706,11775,357,Not The Expert,810000
woTTXW1ber0,Most Realistic Meta Quest 3 VR Games With The Best Graphics In 2025,584,125,171436,1956,253,Gamertag VR,89600
VBXy-MY-vtE,Actually VR 360° I Am Cat - Escape to Girlfriend,104,392,7065399,23218,199,VR Proof 360,68900
0yMnUjBMNB4,NEW Virtual Reality Physics Playground (PhysiX Playground VR),755,1,11761,220,9,WhackyCast,1540000
5qYk5_hXA3k,TROLLING a Tiny Person in Virtual Reality - Davigo VR Gameplay,681,1089,2774951,23264,192,Fudgy,4160000
U8JYfgB4dPM,THE BEST META QUEST 3 GAMES! Top 20 Essential Meta Quest VR Games,694,300,580587,6220,422,Gamertag VR,89600
5arDSMi7i-M,I'm Deleting My VR Game,618,1,235281,5835,2047,jmancurly,4830000
JPmhRsDPzKs,This Spider-Man VR Game is AMAZING! (Oculus Meta Quest 2),748,1399,4003664,31617,1337,Nathie,794000
D7HNXHYDPw0,VR 360° BIGGEST TSUNAMI WAVE HITS THE CITY,180,264,8827087,24965,296,VR Planet - Stories 360,98000
ycV7iFG_l-U,10 Awesome Things you Can do in VR Other Than Gaming!,654,1684,1329872,12587,534,Oskar,60500
Qsna1ChGt0E,How Scary is the Paranormal Activity VR Game?,407,3474,10617062,85028,7782,IGN,19400000
bt0Yc3GwWR0,Playing GANG BEASTS in Virtual Reality - Bonelab VR Mods,613,708,5504835,33177,374,Fudgy,4160000
UX4Qps_VyWI,How My First VR Game Saved Virtual Reality,634,1134,1535972,17420,1087,Rye,179000
SqC5pmndV5o,Free Spider-Man VR Games You Can Play On Quest 3 And 3S,347,323,1103061,12227,434,Nathie,794000
qqRqvPQ7Jds,50 Free VR Games on Quest 2 and Quest 3,2865,148,329001,4519,356,Face Toaster,7180
PsZbJf1BOC0,VirZoom lets you play virtual reality games while you exercise,161,3596,55091,700,51,The Verge,3470000
212hF_DVQLs,Scary Minecraft in Virtual Reality,2371,72,1210254,13319,1014,Kiply,2930000
CdgiDUNhrwA,RIPPING Tiny Person Apart in Virtual Reality - Davigo VR Gameplay,678,670,1488170,12344,123,Fudgy,4160000
qrSZvvxOmTc,Playstation VR2 - Step Into Virtual Reality!,932,932,2667724,29510,852,Venom's Tech,1340000
WiVGR1Up1dw,The Best FREE VR Games That You NEED To Try,504,414,392852,5185,360,Xifo,197000
H5RYC4GNCKA,360° I Got Stuck with the Bad Boy at My New School… But Who Will Save Me? 😱 | Roblox Story in VR,300,177,5850895,39049,403,VRoblox,156000
vB85n6QZj7c,I Became a Security Guard at a Night Club,1716,265,5114960,181259,5164,SMii7Y,8220000
ytnHORZXPBc,25 Meta Quest 3 and 3S VR Games Going For REALISTIC Graphics,678,173,94620,1130,80,Nathie,794000
I_JsxS_T87U,Is This The Future Of VR Gaming?,560,6,20579,847,156,Matteo311,98800
Ee8uX7vym6k,Monkey Feeds POOP to Visitors - I Am Monkey VR (New Game),754,8,403130,3447,679,Fudgy,4160000
yXP307L-fdM,The Incredible Evolution Of Virtual Reality,705,1932,2007325,25720,1588,TheGamer,1750000
sBn3C4k1zFw,Building the STRONGEST Base Yet - I Am Cat VR,631,266,1341817,14827,631,Fudgy,4160000
6adRCbLmklI,Spider-Man Far From Home Virtual Reality | Let's Play | ABC Big Kids,384,2281,1074980,178,0,ABC Big Kids,196000
1PrGa0vRVME,The BEST VR Games by Genre - 2025 Edition,1204,228,457744,6651,565,Matteo311,98800
sehhyRWXQfQ,Wednesday Addams 360° - FIND WEDNESDAY | VR/360° Experience,86,996,4246551,10439,1796,GlitchVR,1250000
KMYpwZoTccE,Let's Talk To Skully! : Waltz Of The Wizard,865,429,2318474,36525,936,TIME,134000
GbMB6QrcY68,I Tried The NFL's Virtual Reality Game...,796,1105,1617106,37299,745,MMG,3130000
FTcbgVC8ong,Does VR Gaming have a FUTURE?,755,121,25309,982,482,Matteo311,98800
2dcXE9j8abc,The Future of VR is Here - Bigscreen Beyond 2 + Audio Strap Review,736,147,1490452,40288,2053,Linus Tech Tips,16500000
zri5afX-sI8,VIRTUAL REALITY GAMES! (HTC Vive) - PBG,815,3417,1584369,31989,4238,PeanutButterGamer,2040000
Uf93uwqYTgk,TORTURING Fruit That's ALIVE - Fruit Salon VR,608,505,4525414,20635,454,Fudgy,4160000
dhgvZIm5Nu4,PlayStation VR2 on PS5 playing Star Wars galaxy’s edge with @fishinjosh #psvr2 #ps5 #vr,14,931,1582898,14340,225,Eli Butler,875
jIZGGKB4p5g,These VR Controllers are CRAZY,21,1222,1874502,50538,881,gramsy,1620
-fVABrDqt0s,3 FREE Mixed Reality Games! #quest3 #mixedreality #quest2 #vr,61,649,79558,4277,56,VR Central,389000
-XnOsmANDng,best Free VR games,15,509,700144,6526,371,ZeekeVR,779
8C1KJ0soYC4,World's Most Dangerous VR Headset,60,1062,19435466,1358320,19172,Alementary,951000
RoZ2yGkfNwQ,What’s your favourite type of BUZZSAW 💿⚡️#Gaming #UNDERDOGS #VirtualReality #VR #vrgaming #vrgame,56,121,120670,,162,UNDERDOGS,39400
oKpx5HxB6l4,Jumping Into The Matrix For The First Time! (PSVR2),26,967,5764051,185857,561,The Gamespace,297000
IJEWzzeJugo,I Am Cat - Kitty's Revenge,46,449,25810528,601675,2600,99TH VR,239000
Lks5M3WrHHM,SugarStar PLAYING I AM CAT! VR Game,2394,282,2645349,19048,4420,SugarStar,8600000
m3Q7D8sjsT4,this isnt the real strongest battlegrounds (THIS IS A DIFFERENT VR GAME),11,409,16525262,413072,2810,LanceStuffs,1140000
kSnxDon7tVw,Travel Mode on Quest 3 is a GAME CHANGER!,19,321,582065,7767,267,VRRay OfMinneapolis,5750
pt0JmOBQ974,"VR Treadmill for shooting games, FuninVR e-sport series of products",18,389,44012,494,27,FuninVR factory,135
6oXCE0QfPh8,"Quest 3 Upgrade - VR Accessories for ""Ganesha""",60,384,1546721,107815,244,A2D Channel,2150000
aKi605K4ghM,A VR game took her life (fiction) #vrgaming #ytshort,29,108,13689293,112384,596,Uncovering WHY,374000
p4KQOkCTzk0,Best Free Quest Games 2024 #quest3 #quest2 #virtualreality,15,696,428657,,84,Timstuh,20200
8sOK6JPZ0pI,【ネコVR】🐈️猫 vs おばさん👵part158 I Am Cat #vr #game #funnyvideo,13,365,2753988,32102,278,天才VR店員れろ-VRrero-,2420000
gM-Y2RgTCaQ,5 Ultra Realistic VR Games you can PLAY RIGHT NOW!,346,741,818480,6948,382,laubox,71400
mxY-gUwU1tI,Here are 3 of the best vr games for your meta quest #vrgames #metaquest #quest3,28,213,402403,8262,143,BL4DEVR,5580
W_ePdbfhXXY,The most realistic VR game EVER!! Half-life Alyx (Gunman Contract)!,13,1169,415341,7261,336,VR Bulldogz,802
R-Ta9Io9_gI,I Lured Granny Into Thinking I Was Being Nice! - I Am Cat,19,211,570235,5574,235,ClicksterVR,11400
L9rJCvcnBVc,VR FAILS!! Mostly Meta Quest 3,29,493,1196429,16925,874,JayBratt,108000
Iyzl5tQ3b4A,MINECRAFT VR!!! #minecraft #funny #family #playstation #vr #ps4 #psvr #gaming #gamingvideos,16,1280,2017939,25295,635,The Lit Squad,4210
r9lZzw2Go78,PSVR2 Unboxing  | PlayStation VR2 | PS5 | #psvr2,12,235,348874,,46,VR GAMEVERSE,2190
ATjeFEJv3zc,Funniest VR Boxing Game Moments That You Wont Forget 😆,58,104,888518,37505,268,Nerve Bytes,7950
nLjF7x9IHSA,Is it free...,12,618,277552,5203,615,UNDERDOGS,39400
my2Ww5zR2gs,Torturing Minecraft STEVE with Claws - Bonelab VR Mods,607,618,4197669,22628,249,Fudgy,4160000
tF17OiU1WEA,FPS ENHANCED REALITY THE MOST REALISTIC VR GAME EVER! #quest2 #virtualreality #metaverse #questpro,15,1073,80878,,41,Timstuh,20200
0Ginbq7fd4I,Here are 3 of the best vr games #vrgames #metaquest #quest3,33,142,510097,10401,279,BL4DEVR,5580
9PFZvvs66lU,The scariest VR games #scary #scarygaming #gorillatag #gtag,15,433,339010,3790,548,Doggo VR,604
s1AZYse8Kao,APPLE VISION PRO VS META QUEST 3!! Whats better!? #applevisionpro #metaquest3 #quest3 #vr,12,572,930087,7601,627,URKN In VR,10800
OQ38Jt_kYLE,Best VR Fails!,12,401,546436,6369,43,VReally,1530
TFVbDNgqqmk,Top 10 BEST PSVR2 VR Games With Realistic Graphics in 2025 - Top PSVR2 Games 2025,380,204,207992,2619,225,Gamertag VR,89600
ylU6xmBhqQ4,Scary VR Prank Nearly Goes Wrong 😂,19,645,121625,3019,25,Zane Holmes,3360000
OHxw0Ji0b3M,BABY destroys the entire HOUSE - I Am Cat VR,1231,401,1014197,4767,274,PowerOnVR,519000
Htj53CAkjQM,Walking The Plank Off A Skyscraper...,29,1114,28653639,592948,1417,Brandon B,16200000
GnLNurI3PdE,Top 10 Coolest Things You Can Do In VR On The Meta Quest 2 / 3 / 3s for New Users - 2025 Edition,858,257,279409,3118,168,UrGamingTechie,26600
UMii9PfovI4,UNBOXING Worlds Cheapest VR Headset,59,652,649196,27931,92,Loggy Plays,422000
p-HlUC5V2ps,"Aww, what a little cuti-... nevermind. 😰",11,86,573519,8130,866,Animal Company,161000
G70yE0AEAcI,PC VR IS REALLY CHEAP RIGHT NOW (MAYBE?),658,13,39708,2523,371,MadmanEpic,17700
RYzKjWbqOW0,CAVE DIVING VR!!,24,102,1844886,25572,852,Luxotic_VR,15500
iZH9RJLbI5Q,This Gunman VR Game is WAY TOO REALISTIC,646,1243,2814522,38823,1942,AwakenToast,451000
T2yf2dJL4-E,This VR Game Should Be ILLEGAL 😨(Scared By Squares),18,9,1439715,25742,416,PapaFearGaming,963000
MfoVjQrGink,The BEST Quest VR Games #quest3 #gaming #vr,23,102,181930,3054,428,GingasVR ,187000
lGeFOiZddC0,10 most popular FREE Oculus Quest 2 games!,42,919,4564993,158054,2112,VR Lad,70400
FQ-QOCPyr08,What YOU can do on Quest 3 with Mixed Reality,10,731,452008,3883,122,David Duggan,126000
_FWU2lbRkW4,I Tested The NEW Meta Quest 3s And... 🤔,23,352,718143,8261,163,Logan Nathanson,50500
ASLupPWnGlo,Spider-Man VR PLAYS A FREE VR GAME #vr #virtualreality #spiderman  #gaming #ad,60,478,2271382,41305,180,Benbu,4570000
ENU70YYZLKU,When SKILL finds you || Pavlov,16,1146,15275176,445028,3421,jBahr | VR Gaming & Tech,27400
4fBO1nUQnmk,A Complete Beginners Guide to VR in 2025,1226,368,127879,2638,253,Matteo311,98800
n5wElqinbJc,Deadwood PHOBIA Clown Splice | Sandbox VR,18,383,559949,3220,9,Sandbox VR,7560
CDskl6ZOcZw,The Top 5 BEST VR Games 😎 (2025),18,291,225304,2506,154,DigiGods,11000
moQrrMFezuI,Did you guess right? THE REVEAL! 👀 #Gaming #VRGames #UNDERDOGS #VirtualReality #VR #VRGame,15,59,1079686,,500,UNDERDOGS,39400
br_ytQiyDM8,Playing VR games is a dangerous activity😭#VR #funny #fail #game #virtualreality,60,6,551663,6103,60,ChaosCuts,112000
Afv9FlTCGTM,Top 5 Quest 3 Vs. Quest 3S Differences. #vr #virtualreality #quest3 #tech,53,360,872591,26593,476,Fix My Oculus,107000
eVz5kcGaniY,Spider-Man VR VIOLATES Shaggy 🥵 #vr #virtualreality #gaming #spiderman,27,1024,66893817,2689949,16905,Benbu,4570000
5Pjmp_Y1v1I,Call of Duty in VR (Contractors VR) | Meta Quest | Sanlaki Gunstock,15,1247,293915,5533,373,Sanlaki VR,3240
C5hConDorsg,The NEW PSVR2 Headset is INSANE for PS5!,24,968,1030625,38741,694,Ben Rowlands,576000
IVDeASYPonc,Best VR Games for Meta Quest! #vrgames #metaquest3 #metaquest3s #vrgaming,41,277,124440,2090,76,MonarchXR_,952
etdF2ZyFc1o,roblox vr dares..,35,660,7115083,297380,3973,LostScout2,3160000
GMijgEnoJMw,I Am Cat - Kitty's Revenge Arc,60,316,3853708,56907,220,99TH VR,239000
K7zNabI5yA4,VR Treadmill Expectations VS Reality…,15,793,251651,3277,74,Naysy,776000
WbpZoq5M25A,I Removed an ALIEN From a Human's FACE! - Surgineer VR,788,435,7095018,30020,1036,Fynnpire,1480000
eRBIEev0Hns,Which Side Looks Creepier? #vr #vrgame #vrgaming #metaquest2 #metaquest3,31,3,15599,614,71,SCARED BY SQUARES,4000
cltxJ5IVO5k,VR Ride Accident,8,1320,4326763,67847,1525,Alec Meyer,5530
z9vdeLDOSbs,10 FREE GAMES ON THE QUEST 2 & QUEST 3!! #vr #quest2 #quest3,30,676,602542,10751,142,URKN In VR,10800
VPopmojMDR0,Epic VR Fails - Kid Trying VR Game Gone Wrong || WooGlobe Funnies,52,1671,365448,9171,385,WooGlobe,1840000
DOfbA2TiYsI,VR Headsets #virtualreality #quest3 #valveindex #htcvive,15,679,396617,5545,1094,Disco Rabbit,718000
AB-dhUs9U1k,Funny reaction to virtual reality roller coaster by SimDesign,66,3400,2528845,19340,252,SimDesignVR,4680
SDChR1fQHUA,This VR game is insane!  #vr #arizonasunshineremake #gaming #virtualreality,10,355,81479,772,31,TwiejkVR,55100
s81BXWmz7kk,"Try finding a better hide and seek game in VR, I dare you! 😤",22,561,4322538,144617,1319,Fast Travel Games,14400
_39VxvkItN4,I Bought Cheapest VR Headset #shorts #ytshorts,29,595,340413,4641,21,Folixx,673000
JNe6O5xJCLA,【ネコVR】🐈️猫 vs おばさん👵part165 I Am Cat #vr #game #funnyvideo,18,361,36184939,539854,2955,天才VR店員れろ-VRrero-,2420000
-NyU05PsiUQ,Free VR Multiplayer Game! #vr #quest2 #quest3 #virtualreality #gaming #questcreatorpartner,47,0,13534,385,14,VR Central,389000
Kyz4FUu6SyI,Any other good games? 🤔 #ps5  #playstation  #gaming  #psvr2  #vr   #vrgaming  #shootergame  #glistco,9,381,981929,6169,77,Glistco,121000
_77rXscvGVw,Really very fun oculus VR games:GorillaSoccer and Gorilla Volleyball.I Can’t believe it’s free! #vr,13,857,137834,1411,71,Gorilla Soccer,1500
21FL1aP40Dg,#vr #psvr2 #hitman #hitman3 #vrgames #vrgaming #vrgame #virtualreality #funny #meme,15,107,3111498,82088,528,BeeMunny,77800
30aSon_X2Cs,VR be like… #gaming #shorts,20,869,8714197,471566,2841,NicsNite,4370000
VrC0FORw9tI,First Time Playing VR Games! #shorts,51,865,18421977,1068461,985,TechBar,5530000
icuPo-ppsaE,"The ₹1,800 VR Headset on Amazon!",50,1005,7107269,360029,1510,Beebom,3470000
N6_b_X-ZqFM,Best VR Games Of 2025… 🎉 #new #vr #update #gaming #recommended,47,1,5500,492,15,ZoomMeta,30900
2XKkXYu8Q9k,GTA IN VR! Quest 3 & Quest 2 Game you NEED to Try!!! #vr #quest2 #quest3,9,655,169903,1737,46,URKN In VR,10800
rfovOpvUTdg,Zombies Are Worse in VR | Sandbox VR,17,579,472212,5489,41,Sandbox VR,7560
qALzbRuuDXA,Funny virtual reality reaction 😀😀 | Vr world Velankanni | #vrgaming #vrworld #short #shorts,21,776,8198837,304290,410,VR WORLD velankanni ,387000
BIA-ljLO7Q4,Stunt Scooter in virtual Reality xGames for Project Third Eye #Quest2 #VR #viral,25,632,264339,4133,353,Project Third Eye,18200
nRHgYsOzUxA,How to draw like a Legendary Wizard - 101 #warofwizards #vrgaming #vrgames #gaming #quest2 #vrgame,19,981,2699068,120212,237,War of Wizards | VR Game,5730
Sv0k9xKqRTY,This game makes you cook Poop Burgers! - Wreckin' Raccoon #questcreatorpartner,53,0,5023,268,11,Naysy,776000
g11Mna9Cv9w,Playing JUMP ROPE in Virtual Reality - Squid Game VR,604,100,429955,3569,203,Fudgy,4160000
Nl-ly1osxTc,100 Ways To DESTROY TEACHER (VR School),896,1318,11421954,191993,1431,ProjectJamesify,5120000
lJB5NJ6kAfk,Spider-Man VR SPEEDRUNS SQUID GAMES #vr #virtualreality #spiderman #gaming #benbu,24,157,2989152,18491,76,Benbu,4570000
JF1c41W3YTY,BEST 3 Mixed reality games for the Quest 3,29,687,132242,2066,9,Liam Shaw,13600
vgVMhWMVtPQ,When Mixed Reality gets TOO real… 🤯 Guardian of Realms Quest 3,11,255,37175,406,8,Guardian of Realms,422
o7OBOyreADM,Breaking Out of Virtual Reality PRISON - Frenzy VR Gameplay (Sandbox),832,1390,8338394,62074,812,Fudgy,4160000
7HpKzA60Uz0,₹150 VR headset from DeoDap 😮 #shorts #vrheadset #techshorts,42,595,4427709,,494,Peek Unik,23300
5guPCQy-kaQ,Truly Realistic VR Survival #vr #vrsurvival #gaming #virtualreality #survivalgame #bootstrapisland,31,585,124763,4488,59,Frontways Larry,16600
vnC889a0TwY,PLAYING THE NFL's NEW VIRTUAL REALITY GAME!!! (INSANE),1014,374,1162356,8036,726,Eli Mack,1150000
ccdYvY2eHxs,The BEST VR Games by Genre - MUST Play VR Games 2025 Edition,1163,81,175370,4150,324,Matteo311,98800
Lu9XbEiqHU0,Granny's teddy bear #vr #granny #vrhorror  #funny #oculus #gaming #horror,12,607,189981,2846,70,Illustrative VR,3500
2NiHbqr6FGo,Nintendo Switch VR Just Got WAY Better! #nintendoswitch  #switch  #virtualreality   #vrgames #mario,30,164,20118,378,1,STARTRC GAMES ,1860
2sCmWmOGqMY,F1 Formula Racing in Virtual reality - Grand Prix Race Highlights 3D VR SBS HTC Vive,369,3007,2235124,10730,98,VR World,17200
lJB5NJ6kAfk,Spider-Man VR SPEEDRUNS SQUID GAMES #vr #virtualreality #spiderman #gaming #benbu,24,157,2989152,18491,76,Benbu,4570000
g0CLG6sOG7A,Creed III Is in VR….,1087,960,4010553,20125,431,MicksCrazy,21300
BIA-ljLO7Q4,Stunt Scooter in virtual Reality xGames for Project Third Eye #Quest2 #VR #viral,25,632,264339,4133,353,Project Third Eye,18200
fYAloM5RDeU,Funny virtual reality games reaction 😁😁 VR WORLD VELANKANNI | vr game #funnyvideo #shorts #funny,23,826,1116000,37179,60,VR WORLD velankanni ,387000
VA9ZVrXe3Yo,5 Coolest things you can do in VR!,50,1028,5599779,292904,1914,Mrwhosetheboss Plus,7000000
JF1c41W3YTY,BEST 3 Mixed reality games for the Quest 3,29,687,132247,2066,9,Liam Shaw,13600
vgVMhWMVtPQ,When Mixed Reality gets TOO real… 🤯 Guardian of Realms Quest 3,11,255,37181,406,8,Guardian of Realms,422
qkAOQjO7ltY,I Am cat VR - GRANDMA KILLED ME,11,416,786822,4994,119,KittenVR,3820
FPH4KyuxCdk,Arizona Sunshine VR zombie shooter #arizonasunshine  #virtualrealitygame #virtualreality #vrgame,12,401,45316,357,34,HEROmation,82500
0yMnUjBMNB4,NEW Virtual Reality Physics Playground (PhysiX Playground VR),755,1,11761,220,9,WhackyCast,1540000
SiXfy1vr_Qw,FREE QUEST 2 GAME! BASEBALL IN VR!!! #vr #vrsports #quest2,10,742,340476,2763,127,URKN In VR,10800
zfNDQR3dGt4,When a dog takes a virtual roller coaster~,14,1492,1949867,30892,309,Where Zhengzhou,374000
2NiHbqr6FGo,Nintendo Switch VR Just Got WAY Better! #nintendoswitch  #switch  #virtualreality   #vrgames #mario,30,164,20120,378,1,STARTRC GAMES ,1860
woTTXW1ber0,Most Realistic Meta Quest 3 VR Games With The Best Graphics In 2025,584,125,171433,1956,253,Gamertag VR,89600
8accVipbseY,Virtual roller coaster in #China #shorts #youtubeshorts,12,1086,225687,1949,7,Rahul Singh ,451
Sv0k9xKqRTY,This game makes you cook Poop Burgers! - Wreckin' Raccoon #questcreatorpartner,53,0,5023,268,11,Naysy,776000
dKWkHsuaNS8,I Became a Night Club SECURITY GUARD.. (VR),1209,235,4579273,28587,1985,Caylus  ,19600000
N1dzJtucWjU,Spider-Man VR PRANKS GREGORY FNAF #vr #virtualreality #spiderman #gaming,11,588,1025217,23260,321,Benbu,4570000
0uCD8fm7hrQ,VR 3D game #funny video 😁 #gaming 🫣,16,397,13512661,250788,476,Ajay KOG,26500
U8JYfgB4dPM,THE BEST META QUEST 3 GAMES! Top 20 Essential Meta Quest VR Games,694,300,580587,6220,422,Gamertag VR,89600
bJAad6flEPc,HAUNTIFY THE BEST VR HORROR GAME! 😱 #quest2 #questpro #metaverse #virtualreality #vrhorror,15,1071,59046,,43,Timstuh,20200
sGAPEwDiGnA,I think I broke It?,28,1059,1146462,1870,29,Kawaii Kunicorn,3610000
ui-oWlVWLc4,New VR Game Makes You Scared of Squares!  #quest3 #scaredbysquares  #vr #gaming #virtualreality,60,9,39895,600,31,SteveKnows,75700
t_bFzKZcPNg,Playing the Most Unhinged VR Games,1780,801,9775100,262504,7497,Danny Gonzalez,7120000
u8GzOMKqdcM,Spider-Man VR SQUID GAMES 3 #vr #virtualreality #spiderman #gaming #benbu,59,105,490852,5299,95,Benbu,4570000
871Yfd1fZog,Best free vr games,27,848,319548,3439,134,Nerd_Gt🤓,657
kBk9vb1AM10,Top 3 Funniest Random VR Game Moments 🥽🔥 #funny #virtualreality #gaming #tiktokeffects,60,36,5289425,177236,761,BrainrotDimension,32600
q8a3M2AwoKo,VR Game Semmaya irukee😍🔥💯 #harishhatricks #comedy #youtubeshorts #metaquest,60,438,1778382,68261,100,Harish hatricks,5660000
qYOpI7KSh1Y,Spider-Man plays SQUID GAMES VR #vr #spiderman #virtualreality #gaming,13,1000,3078852,122520,542,Benbu,4570000
mufeRQYgqZc,I Spent 100 Days in the Metaverse,1010,1339,51403787,1069544,129089,Ryan Trahan,21700000
J2j3qs-0wHU,The WORST VR Headset...,28,896,9629941,288851,2561,jmancurly,4830000
qq1dTbrG264,360° Dinosaur Roller Coaster Ride 2 – Epic VR Jurassic World Adventure,211,111,735677,1807,26,Player One 360,68200
eRb0mQk0kRY,Funny virtual reality reaction 😀😀 | Vr world Velankanni | #vrgaming #vrworld #short #shorts,25,881,83875114,2488705,1203,VR WORLD velankanni ,387000
pKbr1LhfxXM,Worlds smallest 4K headset 😎 TeamVisor.com #tech #vr #technology #virtualreality #squidgame,15,431,24878041,409841,301,Immersed,1500000
j1gusb6lG1U,₹500 FUTURISTIC VR HEADSET (+Gaming) 🔥 | #shorts,19,580,92014,897,8,Naseem Ans,3990000
MNNEfOED1eY,I AM CAT ( ZOMBIE ) vr games,25,1,7986,118,0,AJLoseThatGame,8510
L1gIFbzYlzo,Not real vr funny roller coaster ride #rollercoaster #vrfails #funny,20,865,189348,1706,24,VRgames,29900
xoK2jyg04Ms,VR GAME விளையான்டுறுகிங்களா ?? #Vrzone #virtualreality,43,963,84497,2971,19,90s Vlogger,2910
KZScGAAGfRM,RDC PLAYS HORROR VR GAMES (Devour + Yokai Hunters + Phasmophobia),7666,0,103656,4522,299,RDC Live,602000
Y9DgnM59QTE,Sigma Cat🐱👶👵 - I Am Cat #vr #game #funny,52,104,9099677,136518,465,天才VR店員れろ-VRrero-,2420000
ycV7iFG_l-U,10 Awesome Things you Can do in VR Other Than Gaming!,654,1684,1329874,12587,534,Oskar,60500
rsXAAABqq8M,Playing HELLDIVERS 2 in Virtual Reality - Bonelab VR Mods,608,543,987899,7987,162,Fudgy,4160000
FTcbgVC8ong,Does VR Gaming have a FUTURE?,755,121,25309,982,482,Matteo311,98800
_zqzUTvnjT8,Did you know this about the PSVR2?,23,962,945038,34083,169,Ben Rowlands,576000
SoyrXgrK44c,Spider-Man VR IS A HERO? NO! #vr #virtualreality #spiderman #gaming #benbu,30,118,7688955,46155,121,Benbu,4570000
0vBDNjVnq9c,5 GREAT Meta Quest Games you NEED! #quest3 #gaming,12,300,169057,1588,53,VR Lad,70400
mk07PiTRLjc,Just Cat Things - I Am Cat VR,24,393,1714030,23766,118,PowerOnVR,519000
-1laJ2HF6ds,"JioDive VR Headset Unboxing & First Look🔥100"" VR Screen & 360° IPL Experience @Just Rs.1299 #shorts",59,873,1812913,46229,445,Priyanshi Trivedi ,4650
Q3_oDE2JGus,Spider-Man VR CATCHES HIS SON #vr #virtualreality #spiderman #gaming #benbu,25,0,52577,573,11,Benbu,4570000
qqRqvPQ7Jds,50 Free VR Games on Quest 2 and Quest 3,2865,148,329001,4519,356,Face Toaster,7180
5PHlV51muLQ,This is Real Life Ready Player One 🤯 #gaming #youtubeshorts #vr #shorts,21,3,35905,1382,42,Conroy Jenkins,19500
KZScGAAGfRM,RDC PLAYS HORROR VR GAMES (Devour + Yokai Hunters + Phasmophobia),7666,0,103656,4522,299,RDC Live,602000
JNGih2bIiLM,Spider-Man VR Takes On The SPIDER-VERSE #virtualreality #vr #gaming #spiderman,30,869,2592417,108741,949,Benbu,4570000
iCkjFZ0jv7Y,"New VR Games You NEED To Know About! New VR Games for Quest, PCVR & PSVR2...",832,54,33153,990,134,Beardo Benjo,173000
XJkL8955IQA,Spider-Man VR vs HIS SON #vr #virtualreality #spiderman #gaming #benbu,60,95,46349524,355356,383,Benbu,4570000
-slJTTprXEE,I am Security VR #vr #explorewithquest #quest2 #quest3 #metaquest,46,464,4760009,119238,499,VR Central,389000
Up7REI5Tc2Q,Top 3 Funniest Random VR Boxing Moments 🥽🔥 #funny #virtualreality #gaming #tiktokeffects,47,15,1351455,35751,79,BrainrotDimension,32600
_s707KfLI4M,First Look at the Virtuix Omni One VR Treadmill,46,436,165127,4563,152,CNET,4040000
-EJrsyvTkTc,Top 3 Funniest Random VR Game Moments 🥽🔥 #funny #virtualreality #gaming #tiktokeffects,39,3,21476,655,6,BrainrotDimension,32600
5yxDCw6C6rk,Spider-Man VR ROOFTOP PARTY #vr #virtualreality #spiderman #gaming #benbu,43,197,26147894,346627,539,Benbu,4570000
ZU8N8m8UWqM,#vr #gymclassvr #basketball #lewyvr  #viral #nba #metaquest2 #metaquest3 #oculus #gorillatag #gtag,21,1,27465,510,18,lewyvr,4310
gm4R0BcA4ZQ,Conquer your fears with Richie's Plank Experience! 😣#VR #VirtualReality #RichiesPlank falling,24,336,28256,331,16,Toast Interactive,5490
bt0Yc3GwWR0,Playing GANG BEASTS in Virtual Reality - Bonelab VR Mods,613,708,5504835,33177,374,Fudgy,4160000
oL--PU39Xio,Marvel's Deadpool VR - Official Reveal Trailer | Summer Game Fest 2025,84,135,733573,18353,1684,IGN,19400000
GbMB6QrcY68,I Tried The NFL's Virtual Reality Game...,796,1105,1617106,37299,745,MMG,3130000
HaI1trEIY-s,20 most popular FREE Oculus Quest 2 GAMES!,21,905,755768,27711,531,VR Lad,70400
enT9dKdwlP0,A Shocking Performance For I Am Monkey #iammonkey #vr #vrgame #vrgaming #gaming #zoo #monkey,40,2,26440,180,6,TruGamer4Realz,16300
Qsna1ChGt0E,How Scary is the Paranormal Activity VR Game?,407,3474,10617062,85028,7782,IGN,19400000
WiVGR1Up1dw,The Best FREE VR Games That You NEED To Try,504,414,392852,5185,360,Xifo,197000
yXP307L-fdM,The Incredible Evolution Of Virtual Reality,705,1932,2007325,25720,1588,TheGamer,1750000
xeApql7zeSY,Funniest VR Moments of 2019,1855,2144,91442937,1566339,34384,JoshDub,10100000
tnr4eYr-we4,Prototype 3 In Game #shorts,39,1678,22180390,952424,12562,Lucas VRTech,197000
KMYpwZoTccE,Let's Talk To Skully! : Waltz Of The Wizard,865,429,2318474,36525,936,TIME,134000
ytnHORZXPBc,25 Meta Quest 3 and 3S VR Games Going For REALISTIC Graphics,678,173,94620,1130,80,Nathie,794000
IIIKa_QT7yE,Spider-Man VR IS A HERO? NOPE #vr #virtualreality #spiderman #gaming #benbu,34,195,34681567,413954,208,Benbu,4570000
9pqPqQQGlCY,Another Case Of Crabs In Crazy Doctor #crazydoctor #vr #vrgaming #gaming #funny #questcreatorpartner,34,2,26945,219,6,TruGamer4Realz,16300
JPmhRsDPzKs,This Spider-Man VR Game is AMAZING! (Oculus Meta Quest 2),748,1399,4003664,31617,1337,Nathie,794000
xb_JZYNdFAA,Top 3 Funniest Random VR Game Moments 🥽🔥 #funny #virtualreality #gaming #tiktokeffects,59,0,1402,45,2,BrainrotDimension,32600
