video_id,title,duration_seconds,days_since_upload,views,likes,comments,channel_title,subscribers
u5FNgnx-7do,Mario vs Sonic Olympics Brain Break | Just Dance | Brain Breaks for Kids | Danny GoNoodle,515,449,3698233,949,0,Coach Corey Martin,961000
taHtSVyEfzU,Mario Plays SHIN SONIC TAPES MOD DLC UPDATE,1156,389,3582821,35789,251,Mr. Cringe,790000
7X49C1pRTPw,Top 10 best Super Mario games of all time #videogames #supermario #top,34,790,23300,,62,Vinț Fabian,431000
OM7F49tF4Cw,Donkey Kong Party | Brain Break | Just Dance | Mario Brain Breaks | Freeze Dance | Danny Gonoodle,1192,440,2621238,385,,Coach Corey Martin,961000
AvdearVFNAY,Evolution of Tanooki Mario in Games & Movies [1988-2023] #shorts,31,1009,344010,4788,35,Sirloin,1520000
13yI9X0TANk,Sonic Just Ditched Mario at the Olympics,169,12,110657,5605,1110,Vailskibum,1260000
Ce0IHjvC81A,CURSED Mario™ GAMES,939,1132,1108642,23259,1145,Yahiamice LIVE!,571000
n9_nOA3Md_c,"Evolution of Super Mario Game and Movie, LEGO (1985 ~ 2023)",630,1104,10559951,37954,706,MarioStar,149000
v6Wp9h5XfrA,A BIG Mario Game is Coming in 2026...,51,13,8839,425,20,Game Domain,79000
2ILfazRW2u0,Super Mario Bros. but 999 Tiny Mario guide giant BUTT Peach to Toilet | Game Animation,600,553,6663544,16875,184,Game Up,88700
j9R0B2bVEuk,Ultimate World 1-4 SPEEDRUN trick in Super Mario Bros. (NES)!!,41,295,1453408,30895,550,Doogtoons,633000
NEI-aQkk3OQ,How Mario World was Beaten in 41 Seconds,49,933,16054045,785996,10015,Infinite Bits,585000
vFkuTzjOdP4,Hidden Cheat Code in Super Mario Bros! 😮,13,877,2325762,66847,891,gruz,186000
UcExmSOlxAQ,Super Mario Maker 2 🔧 Don't Press the P-Switch! 🔧 Yoshi&Ken,132,1643,2314099,333,7,DarkX2 - Nintendo Gameplays,318000
0bkAu9JVg2M,"Peach, Daisy, Rosalina, or Pauline?",51,933,3114864,195918,3642,ZackScottGames,5500000
TEWhkPJvWh8,Stunts From The Super Mario Bros. Movie In Real Life,486,774,20601848,195979,1293,Nick Pro,26700000
6_VT2R4oxgU,Top 10 Best Mario Games,396,2918,672264,8826,2310,IGN,19400000
ks9IN7YZO-Q,BABY to OLD SPIDERMAN in Mario Odyssey… (Age Mod),1679,310,3437407,35061,368,Manx Ninja Pig,5430000
rSAaafM7LrY,Super Mario game download Android mobile // How to download super Mario game #gamer #supermario #smg,18,1483,588764,8079,118,Technical Nayan Soni ji,6340
DWgvvjwmvks,"Mario Party 10 Mario, Peach, Luigi, Donkey Kong vs Bowser - Chaos Castle",1785,684,4221654,16962,193,Nintendo Titan,243000
XqHJyk35eZc,Zombie Mario from Super Mario Odyssey | Polymer Clay,63,244,1070227,10602,52,PowerUpClay,332000
oVP5irt49S4,Sonic and Shadow in Mario Kart 8 (Special Cup) 4K60FPS,1571,1363,6219648,6120,80,Sirloin,1520000
a26Jt-Xt1QI,The ENDLESS PIT in Super Mario Bros. (NES)!!,49,556,10575111,335382,2293,Doogtoons,633000
NpjLFgLMUdk,Mario Odyssey but every Moon makes Mario FASTER...,1429,898,13244760,104716,2929,Manx Ninja Pig,5430000
vvOgEzaN6YM,All Sonic the Hedgehog Characters Sonic Vs Shadow Vs Tails Vs Sliver | Super Mario Party,2372,231,348391,302,11,CrazyGamingHub,1150000
G_nzev_-S5E,Play Mario games on the r36s #nintendo #r36s #playstation #gaming #mario #supermario #mariokart #ps5,30,306,36554,503,25,R36S,13500
YUaQQcDQdEs,My Mario Games Collection (Nintendo 3DS Cartridges),1215,294,241191,1381,107,SwitchPlay Gaming,24800
iEEiam1qDfI,The Super Mario Bros Movie Remade by AI... and it’s EPIC!,324,42,538340,2294,128,Clip Chaos,17700
B20UWOhSq7k,What If Everything Mario Can Split Anything He Wants in Half | ADN MARIO GAME,1793,27,137230,1447,8,ADN MARIO GAME,86300
NyGTvF2eQXk,All Characters in Super Mario Party,50,703,9721303,9629,51,MarioPartyGaming,2060000
-Rn3j445QCQ,Super Mario Bros for GBA! 😮,32,604,682997,20008,265,gruz,186000
7quJKudpyps,How fast can you touch a Piranha Plant in every Mario game?,567,572,808566,14005,652,j0rts,208000
a1hOUdrcM-4,I Dangerous Battle With Ludwig Von Koopa #mario #nintendo #retrogaming,41,10,179712,,34,GameSource,18700
kYECr5uHN7k,"Mario & Sonic at the Rio 2016 Olympic Games Football Mario's Team Faces Off Against BowserJr ,Silver",1529,538,1648161,8112,89,VMGAMING,102000
Z_iij1twjfc,3 Super Mario Codes That Break the Game 🧨,43,138,915062,17771,179,gruz,186000
TBtJ-EZNr3Y,Evolution of Game Over in Super Mario Games (1981-2024),949,552,1429908,6669,361,NintendoBase,398000
sn9eXYtK3zY,All Mario Games In ONE Game,25,944,19609,995,8,PapaStanimus,905000
c_b9Yn34pdI,Super Mario Bros - Complete Walkthrough,1844,1040,499663,3585,175,Typhlosion4President,2030000
5gS8KQer4Go,Ranking the First Level in Every Mario Game,725,51,69949,1835,144,Jeremy Klinger,169000
Vx4W3zrKeuk,Evolution of Invincibility themes in Retro mario games (1981-1992) #mario #mariobros #nintendo,52,576,897244,23892,552,Julien ,4700
jWQMY96o6F8,All Mario Game Over Themes (1983-2022),375,1177,5306141,35696,3070,Do The Mario!,13600
nx7nLR90dHs,Diddy REPLACED Donkey Kong Jr?! #nintendo #mariomovie #dkc #mariokart #donkeykong,58,882,12438215,493795,3936,Wentworth Bros,2260000
hvDdgj3j7uA,Mario Party 9 Minigames Challenge (Baby Mario),3723,282,505860,859,33,JinnaGaming,1720000
dpCmgC46uNw,Os BIZARROS jogos do SUPER MARIO do MASTER SYSTEM,926,8,26432,2453,238,RetroGamer Brasil,142000
SBnWokcRhKQ,Which 2D Mario Game Should You Buy? 🍄 - Super Mario Games for Nintendo Switch! | ChaseYama,376,695,11469,168,22,ChaseYama,7300
X2AmZW9DL5c,New Super Mario Bros. Wii REMOVED This...,31,279,665726,19594,173,Tricky Nick,50400
jNd74YapaPc,Comparing The Differences | Super Mario Bros. U Deluxe/Wonder,16,602,110819,756,22,MosbyGamingMachine,198
uKdghdWA2kA,The Top 10 BEST DS Games,44,1061,926092,44076,911,PK Starstorm,26400
hQNAdzmlauc,Super Mario Bros. Wonder – Nintendo Switch 2 Edition + Meetup in Bellabel Park – Nintendo Direct,156,38,352478,9103,1099,Nintendo of America,10000000
dJ37iKgO6vE,Which Super Mario Game Is THE BEST On the Nintendo Switch? (Ranking EVERY Game 2025 Edition),1431,283,11329,175,26,Nintendo Stuff,1020
DIFLHLbhwOM,The Super Mario Bros Movie 🎮 | Extended Preview | Movie Moments | Mega Moments,604,379,13848664,15315,0,Mega Moments,1130000
Hxl8VqOwrqY,Ranking All 3D Mario Games from Worst to Best,795,1983,147676,3781,870,Infinite Bits,585000
EFcbcBhNVeU,Koopa Crush by a gigantic Mario | New Super Mario Bros. 2 | Nintendo 3DS,16,430,345855,4146,63,RetroManiation,23700
Y73r62BvVbI,buying all Mario games for the switch | do you like my collection? #supermario #nintendoswitch,39,432,30720,766,91,MrKong,4510
beOBf5YcSQw,Evolution of Super Mario Bros. Games [1985-2023],667,784,419206,4339,169,Eryx Channel,87300
f3tf1U0amUo,Testing Mario's Most SCARY Myths…,1895,115,10049494,61554,11327,Manx Ninja Pig,5430000
S5lFGbgLpJE,Fixing Nintendo’s Worst Remaster With Mods,1238,23,211988,10286,739,Retro Renew,38400
7WPQ--s5N8U,Super Mario 64 on DS Lite!!,25,469,425893,,129,Samtendo,53300
KMmr6npc27s,Mario Party 9 - Step It Up - Mario VS Luigi VS Peach VS Daisy (Master Difficulty),1151,2766,31284726,91278,1899,Typhlosion4President,2030000
7zeBv12UzmQ,TOP 3 game MARIO favorit saya! Kalo kamu suka yang manaa? #shorts,52,927,284584,19374,811,Gerald Vincent (geraldvincentt),1360000
77eF85wBVoA,Do You Agree That This Is A Very Easy Boss Fight? #mario #nintendo #retrogaming,19,12,264261,,32,GameSource,18700
Y8m4upMBuxc,Super Mario Galaxy + Super Mario Galaxy 2 Switch 2 Review - The Final Verdict,601,15,29249,573,150,GamingBolt,1330000
62-cxkk2mTs,Ranking Every Main Series Mario Game #shorts,51,1686,158539,7647,892,Jeremy Klinger,169000
LyVh2g3--Vc,Ranking the Final Boss of Every Mario Game,1001,65,212984,3671,305,Jeremy Klinger,169000
H3wxLhIIllE,Make Your Own Mario Game Themes?! - Mario Multiverse Public NEW UPDATE!!,1775,40,61051,1344,263,Blue Television Games,771000
h7VmwytVJKk,We can finally play this game on the Switch 2! Super Mario Galaxy and Super Mario Galaxy 2 Gameplay,53,18,32223,998,40,legizzle,17900
HOrmsXjvOb8,"Mario Odyssey, but Moons = More REALISTIC...",1058,1024,10710017,160091,2557,Manx Ninja Pig,5430000
MzWo0_hNRa4,TOP 10 MARIO Games on Nintendo Switch,587,326,6129,87,2,SwitchTop,25300
spnjGtUACQE,Mario Games vs Bluezão,34,1083,55214,2942,126,Lucas Z,5090
eUKBhDM15X4,Evolution of Castle Levels in Mario Games (1985-2020),2764,1847,5128189,21411,331,Typhlosion4President,2030000
Ore8AveieL8,Mario Wonder's Grappling Vine Glitch,81,14,75070,4165,78,Rimea,54300
lufJyiscxYg,Super Mario Party Jamboree - Full Game Walkthrough (All Boards),26022,347,487585,215,5,MarioZenium,1150000
Sn45Zzxjvo4,"Mario's Happiest😁, Saddest😭, Angriest😡, Spookiest😱 and Sleepiest😴 Music",168,274,8569958,1086,37,Piano Music Bros.,2790000
f02K8Fu5GBQ,Super Mario 3D All Stars was a SCAM!!,22,11,59066,733,177,Itz Xternal,7620
S8xezeRy2Y0,7 Hours of 3D Mario Games to Fall Asleep To,24527,498,708242,7495,231,Nathaniel Sleepy,55100
yHcRX7wkx2c,Super Mario Wonder is a Bad Game...,60,401,604771,11801,1245,DanCorona,8060
NUKQD4GynHw,Brothers Fighting over New Switch Console 🎮👊 Super Mario Odyssey Story,1473,120,1316561,5235,386,K. Tze – Friendly Gaming,165000
FkbUA6OBrVg,Playing as HULK in Super Mario! (Mario Odyssey Mods!),1578,59,4066557,57254,540,Manx Ninja Pig,5430000
H8-iWR4hDEo,Mario Kart 8 Deluxe 200cc Full Game (All 96 Tracks),14577,436,729617,1897,46,NintendoCentral,1380000
ZVkZWWt8Xsc,Top 15 Mario Nintendo Switch Games | What's your Favorite?,600,534,1705805,5246,185,Nintendo Games,180000
bc2rVDhj0SY,The Rise of Daisy #mariomovie #gametheory #supermariobros #supermariobroswonder #nintendo,35,847,3658472,135311,716,Wentworth Bros,2260000
oI5OyGlFHMc,Ranking ALL 704 2D Mario Levels,26370,373,1184469,26055,5321,Odyssey Central,308000
yjZWGpwndT0,Lego Luigi enters the Nintendo Switch to save them ALL! #legomario,708,81,583995,1778,78,ZafZaf Films,74100
z5TIh1gRNls,The Rarest Mario Game You’ve NEVER Played! #retrogaming #collectiblelane #nintendo,39,12,19015,546,12,Behind The Lane,2250
hDRDcCT3q_M,Super Mario Course Complete Playset!,526,446,761471,371,16,sonictoast,257000
Ow-iq9SlQaU,Evolution of Goomba in Super Mario Games (1985-2023),257,649,504690,338,24,NintenU,917000
Yk60Vxwllh8,Evolution of Race Levels in Super Mario Games (1996-2025),1109,14,44841,416,10,NintendoBase,398000
Zf9JOkMN1h0,Ranking All Mario Games With Memes!,38,963,77380,3049,178,PlugNPlay,23300
gafnIbClLDA,Busting Scary Mario Myths to Prove them Real!,1004,338,1805218,29847,680,Infinite Bits,585000
NiDpsamwnJ8,Bowser’s Fury but every Shine makes Mario JUMP HIGHER...,1388,1177,11231188,37067,941,Manx Ninja Pig,5430000
gqA-7z5HSYA,Super mario 2 Best 8 bit games cassette,16,871,405563,3342,42,Hindi Retro Gamer,1390
3rk6jqcYRxQ,Mario vs Suika  | Mr.Sun PHASE 1-100 Transformation | ADN MARIO GAME,2300,39,10148,844,3,ADN MARIO GAME,86300
-AN1iB7G7e4,Mario Wonder but every Seed makes Mario JUMP HIGHER...,1708,723,3890164,25578,869,Manx Ninja Pig,5430000
Mn2Uy0gV-A4,SIRENA #peppapig #funny #memes #mario #games #animation #ajjubhaiinmymatch #banban4 #duet,6,8,216823,649,1,angela_cute,27600
uITuTuj60zQ,Mario Galaxy Vs Mario Galaxy 2,1315,16,65374,1382,161,StrawHatMidas,47500
lwcFpI3ddTM,마리오의 신발엔 뭔가 분명 특별한게 있다??,29,11,442503,4727,70,겜노트,6450
nq1QO-cqhjg,SUPER MARIO ODYSSEY 2 (Fan Made) : The Full Game,3086,1100,4568585,28138,876,Manx Ninja Pig,5430000
_NaOqUfMoiI,슈퍼마리오 김수한무는 왜 이름이 이럴까?!,23,10,243797,2604,90,겜노트,6450
a1hOUdrcM-4,I Dangerous Battle With Ludwig Von Koopa #mario #nintendo #retrogaming,41,10,179712,,34,GameSource,18700
WDlDwppz6Xc,Crazy Mario Bros: The Secret Gaming Room!,2119,470,4183555,47591,5048,CrazyMarioBros,1090000
Rk8kbhmaHwc,Jump Mario! Bullet Bill Ambush! #mario #nintendo #retrogaming,16,13,161477,,14,GameSource,18700
dS6rnl8b8b4,Evolution of Mario Dying in Quicksand (1988-2021),340,1735,7468513,17701,526,BeardBear,1390000
2-pkK6sszMQ,Super Mario Odyssey (Switch 2) - Full Game Walkthrough (4K 60FPS),9421,135,1057422,1612,95,BeardBear,1390000
qdNW501yZmw,Super Mario 3D World - Longplay | Wii U,20675,1172,1337300,4839,85,Project Longplay,354000
jW9jkcZhBUw,Mario's & Luigi's Mansion 3 - 2 Player Co-Op - Full Game Walkthrough (HD),37822,100,859393,1810,47,Sirloin,1520000
t24ixEdiHT8,Nintendo Mario Kart Steering Wheel 🏎️ #Shorts,11,1230,411634,4771,122,OfficialChiKa Gaming,1420
KdZU1vhxkg8,New Super Mario Bros Wii + U - Full Game 100% Walkthrough (2 Player),42379,853,2053629,7724,152,NintendoBase,398000
Dxy8hMtW2Sk,The Greatest GameBoy Mario Trilogy? #dkoldies #gameboygames,35,553,265738,7706,147,DKOldies.com,1800000
XXt3scj4K8g,Lost Mario Games Nintendo Never Wanted You to Play,753,33,253,16,6,MicksCrazy,21300
qAu7KkfEEUU,BEST Selling Super Mario Games #mariomovie #supermario #mariokart #nintendo #nintendoswitch,59,930,189545,4449,230,Robo Data,25700
-hMrMH7Dsqo,O TERRÍVEL ICEBERG DO MARIO GAMES,6428,118,164286,9581,641,Raposito,218000
QUMnGoGeFew,"Great, But I Think You Over Used It 😂 #mario #nintendo #retrogaming",33,14,50814,,3,GameSource,18700
AVi-SSsbD8U,Evolution of Bowser Deaths in Super Mario Games (1985-2025),793,42,23224,380,35,Nintendo Smash ,719
PkyK9Lo5FIc,O que aconteceu com Mario games?,977,400,37947,2150,181,JH,779
WP9TT4uze-0,Mario Party 9 Step It Up - Peach vs Luigi vs Daisy vs Mario Co-op 4 Player Gameplay (Everyone Win),1014,2764,3438281,6997,191,CrazyGamingHub,1150000
5Mzk1UQS_pE,💥 New Mario Enemies 💥,29,964,1584460,46956,269,Manx Ninja Pig,5430000
h8ss2ST5-w8,Evolution of Level end in Super Mario Games and LEGO (1985~2023),904,88,173887,954,20,MarioStar,149000
llzGfnb07rI,The Most Useless Coins! Agree? #mario #nintendo #retrogaming,13,13,42808,,2,GameSource,18700
wvaW1l90Ecc,Evolution of Cosmic Clones in Super Mario Games (2007-2025),554,30,138857,1197,31,NintendoBase,398000
S2AFon8bZ7s,"Evolution of Super Mario Death animations and Game Over Screens (1983~2023, Game and LEGO)",481,648,3213576,13204,853,MarioStar,149000
ebO67PuW56Y,Hurry Walls Moving! Get The Red Coins #mario #nintendo #retrogaming,17,15,449257,,10,GameSource,18700
l5JTTST58NQ,【Wii】こでかクリボーVSでかクリボー #shorts #マリオ #ゲーム #任天堂,53,11,42016,728,27,ぐぎぎ,3540
Bf4xJHA1nEQ,Revisiting The Highest Rated Mario Game! - #mario #nintendo #wii #mariogalaxy #nostalgia,38,573,180546,8174,148,DKOldies.com,1800000
lXw4UHwZ2HM,All New Record Animations - Mario & Sonic at the Olympic Games Tokyo 2020,56,1015,432321,8964,252,packattack04082,5960000
J4f8ln3Jztk,TOP 3 Super Mario Bros. (NES) Super Gaming Secrets of 2024!!,168,332,643971,22986,547,Doogtoons,633000
2wBqvKaOY08,RENANPLAY FAZ LIVE COM MARIO GAMES E O FINAL FOI INESPERADO,864,116,43124,2692,774,Leon S. Kennedy 3 ,18800
0DwmlW0Ygzw,주인공의 빈자리를 메꾼 몬스터? #mario #nintendo,83,10,157222,2745,59,스아의 게임이야기,32300
K8Rc2pLFf5U,Will The THIRD Mario Movie Be SUPER MARIO ODYSSEY??,64,13,16344,1178,16,RomansEmpire,39200
vDwQpTFW2us,Super Mario Odyssey - 100% Longplay Full Game Walkthrough No Commentary Gameplay Playthrough,84406,1661,11280655,35088,1087,Ninbanyan,59400
GHOy3syzsvI,Thanks For Mr Shell 😘 #mario #nintendo #retrogaming,40,14,76323,,13,GameSource,18700
YpP5qjBLVQM,Super Mario Bros. Wonder Full Game (100%),20477,732,3751525,13791,679,NintendoCentral,1380000
cWxB7Omsfy0,Evolution of Mario Super Stars Dying and Game Over Screens in Super Mario Bros Games (1985-2024),243,612,913102,4641,345,8BIT-ANI Gaming,28400
13ieq0wTB2E,Super NES – October 2025 Games Update,116,12,209582,8650,2375,Nintendo of America,10000000
3Tc_Ek0ASSA,Super Mario World - Complete Walkthrough,9637,1838,8467887,54210,2780,Typhlosion4President,2030000
5SOC31Udcis,Super Mario Maker 2  - Full Game Walkthrough,20587,1941,7112359,19920,595,packattack04082,5960000
QHkM-6ZNlsc,I Google Translated Mario Wonder 100 Times [FULL GAME],10690,16,92214,2177,110,Skippy T,374000
wOfDR28bxxI,I Played EVERY Mario Game On Nintendo Switch,1887,152,184915,3808,312,Russ Vandy,138000
QbeEaF4CGi4,All of my New Super Mario Bros. games collection,595,342,634373,2771,184,SwitchPlay Gaming,24800
zbwdHqtOV0w,New Super Mario Bros. U Deluxe - Full Game 100% Walkthrough (4 Players),23658,1740,7306360,28613,1171,BeardBear,1390000
xjys9MYwi5A,All Theme Too Bad + Game Over | All Super Mario [720p] | 1983 - 2024,274,330,245321,1840,212,Gesbriel Maia 2.0,2600
4_JQsWPHtEI,Super Mario Galaxy 1+2 had the WORST Opening Week of ANY Mainline 3D-Mario Game in Japan,1120,11,52289,2102,1254,NintenDeen,30000
wp7ioWHfxc4,"Evolution of Bowser in Super Mario Game and LEGO, Movie (1985 ~ 2023)",500,1089,6217279,25776,276,MarioStar,149000
w114LDitnlY,Super Mario Party Partner Party #166 Domino Ruins Treasure Hunt Yoshi & Mario vs Bowser Jr & Bowser,2641,2371,4418255,8361,139,Mario Games,394000
OnboVccVF9s,देखिए MARIO GAME की ENDING कैसे होती है 😮 #shorts #facts #youtubeshorts #mariogame,25,1506,91619,596,12,This is Akshat,68300
jxqPvfVyAng,Unboxing Every Mario Game I Own (1985-2025),2771,179,153446,1521,119,OpenGame,384000
9KKKBT5ib2E,"""POV: If You Love Mario But in Minecraft 😍🍄 | #shorts""",12,11,46545,,5,ROYAL-KINGDOME,112000
iqbwO70dNPk,THE EVOLUTION OF SUPER MARIO GAMES ON PIANO (1983-2023),561,747,943624,1010,41,The Green Notes,1820000
UVmr0DZe8k8,Evolution of Pauline in Mario Games (1981-2020),1035,2037,3646221,10227,679,NintendoCentral,1380000
o4qZcuRueic,How to make Super Mario Game from cardboard. No electronic components required! Anyone can make!,885,1735,10736677,60849,1369,Turbo Fun Crafts,355000
A7qac5AZRlY,Super Mario Run - Full Game Walkthrough,3711,1429,3364905,16560,563,packattack04082,5960000
K5QXntHSbDM,"Evolution Wario Falling Lava, Game Over Screens in Super Mario Games And Fan Mod Games (1985-2025)",301,255,103568,482,37,8BIT-ANI Gaming,28400
XIJwKWJjvzU,Mario Party 10 Mario Party #155 Mario vs Waluigi vs Donkey Kong vs Toad Whimsical Waters Master,2079,2578,4912855,13661,369,Mario Games,394000
MR37TFyCv1U,Is Donkey Kong Bananza the NEXT 3D Mario Game?,389,123,16050,618,153,SF Productions,68800
0--SiN8wOjY,Goomba's Didn't Make It Easy 😂 #mario #nintendo #retrogaming,13,13,50468,,4,GameSource,18700
N4MLyBU9XVI,Trolando mario games com a voz da minha irmã.,171,1959,49266,1381,244,mario games troled,164
yuzvRqzCQvk,EVOLUTION  OF SUPER MARIO GAME OVER SCREENS! (1981/1983-2025) | MARKIS MARK TV,1089,76,95335,564,16,MARKIS MARK TV GAMES,434
OtCtYEMgeH8,Evolution of Funny Moments in Super Mario Games (1990-2021),2370,1509,2454970,13205,568,BeardBear,1390000
rcX7aV5meKU,What Happens When You Get 100% Completion in Mario Games? (1985 - 2025),555,68,111384,1586,119,Nintendo Unity,899000
jHN0oC96CPg,"Evolution Princess Peach Falling Lava, Game Over in Super Mario Games And Fan Mod Games (1985-2025)",416,143,154586,769,56,8BIT-ANI Gaming,28400
WCkN1KtNv1w,Evolution of Luigi game over with Death animation in super mario Game and LEGO,584,158,394787,1848,90,MarioStar,149000
9UjtAen_EyI,"Sliding into the new world like, “yeah, I’m ready for this.” 🕹️#mario #nintendo #supermario",16,13,102352,681,3,Yoshi's Yesterdays,5800
vHUeWkabX3s,Super Mario Bros Wii was Better 😭,20,17,113293,1021,39,PK Starstorm,26400
BQq4y5_jIww,New Super Mario Bros. U Deluxe - Switch 2 Edition (100%),18316,114,276521,1489,51,NintendoCentral,1380000
Rz0osv2DGJ8,Evolution of Bowser's Big Blast in Mario Party (1999-2021),528,1451,15498393,11032,401,packattack04082,5960000
36jzHUWK4K8,Maxine's pranking Hazrat #animation #memes #funny #speemario #gaming #funnyimages #games #cartoon,8,8,30133,129,0,HAZRAT Official ,59300
stC6IB3i0qc,CREEPY MARIO GAMES 2 - SpaceHamster,1566,2746,3030946,43562,7583,SpaceHamster,794000
zl_qXgGMdsA,Super Mario Collection - Happy 35th Anniversary!,2682,1863,455176,5220,961,Nintendo Collecting,150000
xCoszT9IgyY,It's Time To Shine Tiny Mario! #mario #nintendo #retrogaming,21,15,838197,,55,GameSource,18700
NKWrEEFsStc,Evolution of Time Up in Mario Games (1985-2020),506,1901,4443693,12580,526,Typhlosion4President,2030000
0wX6fWx60bU,Super Mario Bros. 3 3-4,61,11,35120,424,3,Mario's Pad,1120
YDiRJqoUnrg,Evolution of Final Bosses in Super Mario Games (1985-2025),6168,731,3190984,19041,676,BossRunner,26200
VAZAtNsxcGs,When the Game Just Doesn’t Want You to Win 😳🔥 #mario  #nintendo  #supermario,12,11,39297,306,8,DaddyGames,15200
8XtMFuyVDpE,ヨッシーと戦争#shorts#smm2#マリオメーカー２,64,10,202961,2201,34,とぱんだ,55400
LZJLfElJkx4,Could there be a LEGO Super Mario Game?,17,7,25861,845,11,MrAJKid,2050
DeUTFObJd4c,A 【Estranha】 Saga De Mario Games,904,1195,35049,2249,151,Mestre da Internet,6000
Ib3f3uSdowA,Baby Mario Hazrat#roblox #funny #robloxedit #memes #games #speemario #gaming #funnyimages #animation,7,8,109810,274,1,HAZRAT Official ,59300
b3QE5dDh4G8,Evolution of Lava Levels in 2D Mario Games (1985-2025),1291,14,7279,85,9,Nintendo Smash ,719
rFVOpCGps2I,Mario’s Disaster Happened Too Fast 🤯 #mario #nintendo #retrogaming,20,14,104427,857,9,Yoshi's Yesterdays,5800
skXD9kfKUUY,Evolution of Mega Mushrooms in Mario Games (2000-2017),724,2991,16172164,55491,1509,ProsafiaGaming,4940000
LaOiF6JiZAw,Why people who love Mario games must play these games.,30,13,1275,24,4,Zeldadude2026 ,197
mS5_1Avjx4Q,【Newスーパーマリオブラザーズwii】マリオwiiのボス戦をノーダメで完全攻略のやり方がヤバい #shorts #マリオ #スーパーマリオ #スーパーマリオブラザーズ #攻略 #ゲーム #小ネタ,28,10,14286,176,3,セワシ　【熱血系実況者】,3610
izKVKYTyNp0,Super Mario Brothers 3 NES gameplay,58,8,1472,39,4,RETRO ADAM,5160
qD5pnuPRq2Q,All red coins collected by just pressing jump only for the 1Up escape #mario #nintendo #supermario,12,13,60421,347,2,Yoshi's Yesterdays,5800
Zb9kkPoJ43c,Name your favorite mario game!# #supermario #mario #supermariobros #nintendo #mariokart #games,72,9,1404,7,3,shIela,12
srWh0JJeSFk,海のうず VS マリオ #shorts #マリオ #ゲーム #Nintendo,26,13,49205,271,11,おまつり,9630
Nmwy-1PCx8o,'Mario in Space' 🚀 Super Mario Galaxy | #shorts,31,16,338610,12453,68,Cas van de Pol,8380000
xAOdTJRpyUw,Sad that It wasn't an easter egg #mario #games #facts #foryou #egg #secret #nintendo #zelda #sm64,19,12,28446,517,11,SuperMario64,45
jHN0oC96CPg,"Evolution Princess Peach Falling Lava, Game Over in Super Mario Games And Fan Mod Games (1985-2025)",416,143,154586,769,56,8BIT-ANI Gaming,28400
-dM47S8h92I,Can Mario vs Marble Race SUIKA Watermelon Calamity Maze | MAMA MARIO GAME,678,17,36931,97,6,MaMa Mario Game,1190
rcX7aV5meKU,What Happens When You Get 100% Completion in Mario Games? (1985 - 2025),555,68,111384,1586,119,Nintendo Unity,899000
BQq4y5_jIww,New Super Mario Bros. U Deluxe - Switch 2 Edition (100%),18316,114,276521,1489,51,NintendoCentral,1380000
-hMrMH7Dsqo,O TERRÍVEL ICEBERG DO MARIO GAMES,6428,118,164280,9581,641,Raposito,218000
eGjNPSf4e0E,Super Mario Galaxy 1 & 2 Review,1117,12,12218,210,64,Gamekings,59700
oVWec4zMMl4,SUPER MARIO GAME WATCHES and MORE DIYS,482,1522,7719934,33981,0,Kiwi Show,2610000
J0GmrCMl_BU,Mario Games for Nintendo Switch Review! (Also 1 Kirby Games),490,9,249,1,0,DiegoSierraGames,106
PkyK9Lo5FIc,O que aconteceu com Mario games?,977,400,37948,2150,181,JH,779
Rz0osv2DGJ8,Evolution of Bowser's Big Blast in Mario Party (1999-2021),528,1451,15498393,11032,401,packattack04082,5960000
SNl6WJygciw,Super Mario All-Stars - Full Game Walkthrough,13719,1633,3880484,18053,931,packattack04082,5960000
9UjtAen_EyI,"Sliding into the new world like, “yeah, I’m ready for this.” 🕹️#mario #nintendo #supermario",16,13,102352,681,3,Yoshi's Yesterdays,5800
gb_OfVnW_Js,Ranking ALL 57 Mario POWER-UPS (From ALL Games),1203,12,459,8,4,Nintendo Stuff,1020
Zb9kkPoJ43c,Name your favorite mario game!# #supermario #mario #supermariobros #nintendo #mariokart #games,72,9,1404,7,3,shIela,12
yRyEj-nEllM,3D Super Mario Games | Ultra Game Bros #012,4503,6,199,7,1,ONEDASHONE,748
zl_qXgGMdsA,Super Mario Collection - Happy 35th Anniversary!,2682,1863,455176,5220,961,Nintendo Collecting,150000
36jzHUWK4K8,Maxine's pranking Hazrat #animation #memes #funny #speemario #gaming #funnyimages #games #cartoon,8,8,30159,129,0,HAZRAT Official ,59300
SdEH8httGjI,"Please Help Mario Escape UNDERGROUND  - Peach, Daisy vs Rosalina",53,14,129722,4095,3,Raize Times,114000
Iu6gdN_AC_0,Why Do Mario Games Always Sell Well?,346,9,176,9,3,EC,1280
cfyveTZCrMU,Why people who love Mario games must play these games.,784,8,3,0,0,Zeldadude2026 ,197
XYATN48av5o,Super Mario Bros Remastered HD: Super Mario Bros 3 Style,1683,9,12610,160,8,aacglucas,284000
S22Gnf7nTds,Mario + Rabbids Sparks of Hope - Full Game Walkthrough,34895,1093,1659541,7266,287,packattack04082,5960000
stC6IB3i0qc,CREEPY MARIO GAMES 2 - SpaceHamster,1566,2746,3030948,43562,7583,SpaceHamster,794000
LZJLfElJkx4,Could there be a LEGO Super Mario Game?,17,7,25861,845,11,MrAJKid,2050
0JTxrDaRHkI,Mario treating danger like it’s just Monday stress 😤🔥 #mario #nintendo #supermario,18,8,24380,217,4,Yoshi's Yesterdays,5800
bAZhGhpz7IU,400 Games in 1 - Super mario game | Game box,58,462,28809,440,8,Anant Electronics,60400
6qiqR2jFZks,Big & Small Cars Jumping into Super Mario Open Mouth,32,14,650214,3906,3,YungGranny Shorts,155000
8XtMFuyVDpE,ヨッシーと戦争#shorts#smm2#マリオメーカー２,64,10,202961,2201,34,とぱんだ,55400
LlJDnsVa63g,MOST OBSCURE MARIO GAMES #2 | Every Mario Game Ever Spinoff Shorts #3 #retro#mario #obscure #gaming,102,103,1231,47,4,FruitBytes,993
gkAxRG59Bv4,Les 5 PIRES jeux MARIO !,1210,10,12299,628,107,Kirb'edito,63500
rq1KoLgzXv8,The Most UNDERRATED Mario Game...,81,60,1624,51,2,Game Domain,79000
xAOdTJRpyUw,Sad that It wasn't an easter egg #mario #games #facts #foryou #egg #secret #nintendo #zelda #sm64,19,12,28446,517,11,SuperMario64,45
