video_id,title,duration_seconds,days_since_upload,views,likes,comments,channel_title,subscribers
odAGjWf9pS4,Lesion 3K! #rainbowsixsiege #rainbowsix #siege #twitch #r6 #r6siege #youtubeshorts #asmr #clutch,15,756,1481,17,2,OnyxOmg,8840
Ll9KlpAndHI,BLAST R6 | North American League 2025 - Stage 1 - Day 5,23950,115,72339,859,39,Rainbow Six Esports,1420000
N4uxtFmgW7M,Rainbow 6 Siege Montage #3,134,1371,61,7,2,The Pub Community,53
1Vuqv72epck,SOUTH AMERICA LEAGUE - ETAPA 2 - PLAYOFFS - DIA 2,21600,7,38515,1043,2,Rainbow Six Brasil,447000
X3eoYhTWflc,Copper To Champion Episode 2 (SIEGE X),8224,91,1092263,20452,1994,Jynxzi Live,1440000
ysdPtBZjOnM,NEW FLICK IN ROCKET LEAGUE!!(read description),14,1890,340027,7941,889,Cozzy,15400
86KDOeRzFHU,CAN I BEAT 5 DIAMONDS WITH BEAULO (IMPOSSIBLE),2623,41,215690,5557,181,Spoit,1260000
AnwPvzQCCOw,1V4 CLUTCH CON ALIBI?! - Rainbow 6 Siege ITA #shorts,59,973,21149,1190,7,ReiZIV,99300
c-E1gBStHP8,The Entire History of Cheats in Rainbow Six Siege,971,178,178307,3189,211,R6 Central,19400
xss8LOzZ5fo,"Highlight Reel #312 - This Ain't Rocket League, Son",349,3037,194797,3316,137,Kotaku,357000
InYYaJNJwTk,BLAST R6 | EML 2025 - Stage 1 // Playoffs Day 2,33695,96,166712,1907,56,Rainbow Six Esports,1420000
Xi_8XNmLGic,Did not expected this Rank |Rocket League 3v3 | PS5,591,10,1,1,2,LetsPlaymitConnor ,81
EsyF_ZYlRmA,Tom Clancy’s Rainbow 6 Siege Loading Screen Part 2,20,1893,603,19,6,Loading Screens Gameplay,950
D-D_b6qyYrQ,Prima RANKED su CONSOLATO Nuova e SUBITO... - Rainbow Six Siege ITA Gameplay Ranked,1489,859,3514,153,3,ReiZIV,99300
UcNo8UOYk6o,#rainbowsixsiege #rainsix #rainbow6siege #fyp #fypシ,10,1200,318,6,0,Magic,481
JofQ8XnQbvY,The BEST Oregon Strategy in Rainbow 6 Siege,47,685,555851,31194,117,Poxonlox,375000
OhVpfXnCTdw,Faccio il Call Center su R6? - Rainbow 6 Siege ITA #shorts,13,1059,3474,118,1,ReiZIV,99300
m7eQ2KTFBQs,"Mi Club KarMaCluB (con rainbow six siege, overwatch, rocket league y ww2)",399,2986,253,27,62,Ruben,1160
q0y-0ZlwwUw,Leapfrog in Rainbow 6 Siege 😂,9,1283,1908,54,0,heytayven,1320
9OWUdefKZJY,Game of Ramming People | Rocket League 3v3 | PS5,823,11,1,1,2,LetsPlaymitConnor ,81
OdEvqCG-jJc,Rainbow 6 Siege Livestream Deutsch-German / PS4 Live / JureX_YT,18883,2731,120,9,0,Julian.mk1,79
KHuFzwFp4zI,More Solo than in Team | Rocket League 3v3 | PS5,736,12,1,1,2,LetsPlaymitConnor ,81
RMHB-T6_Xo0,RAINBOW SIX SIEGE MONTAGE COMPILATION,181,2444,183,20,6,SunkiX,37
0ZVAYesyoPA,10 PRO LEAGUE SITE SETUPS - Rainbow Six Siege,958,143,5641,187,9,cheezit,4740
5wECQIbzo88,WHEN STREAMERS HIT INSANE CLUTCHES! Rainbow Six Siege,614,459,211682,2594,45,Rainbow6 Hub,198000
BulPmoYg4eg,Lovely Matchmaking | Rocket League 3v3 | PS5,808,13,1,1,4,LetsPlaymitConnor ,81
RNsngKWWw9E,G2 Esports vs FaZe Clan | R6 Siege X at EWC 25 - Day 2 - Group Stage,5690,74,32510,404,36,Rainbow Six Esports Match Vods,59100
CxJ27Cq-N3c,Can my Teammate and me Improve? | Rocket League 2v2 | PS5,945,20,2,1,2,LetsPlaymitConnor ,81
ocZVJ91cJuU,What can i do without my Mate? | Rocket League 2v2 | PS5,686,19,1,1,2,LetsPlaymitConnor ,81
qRNHa9Piv6w,"DE LA DROGUE AU REGIMENT ! FUNNY MOMENTS (Rainbow six siege, Squad, PUBG, Rocket league)",501,2910,4606,235,10,Kalelytb,22900
d3jcPb0bmwc,Flawless Victory | Tom Clancy’s Rainbow 6 Siege| PS5,1225,21,4,1,0,LetsPlaymitConnor ,81
hcDHzyqmYB0,Tom Clancy's Rainbow Six Siege head and shoulders |#Twitch #shorts #gaming,29,433,3214,17,11,Liger,155
PyldHUK-yvQ,Soon its time for my Rank! | Rocket League | PS5,831,18,2,0,0,LetsPlaymitConnor ,81
daH5nZ3Xlpo,THE RAREST ITEM I’VE EVER SEEN IN-GAME,24,706,8947,171,6,Kazari,876
RnY3XhXQeN0,Ranked GC Grind clips!,60,1097,542,12,0,Kikko_RL,12
5xyLdTdey-o,I got demo’d and only just respawned in time for the perfect save! Like if you’ve done this,16,1341,1900,47,0,NxgesyII {SHORTS},31
0qijH2iUrZA,FIRST CEILING SHOT IN GAME | ROCKET LEAGUE,7,1155,1848,51,21,LetsGoYayo,1280
7hb5h20qqGk,THIS LOST US THE GAME | Rocket League,18,1152,13190,160,14,LetsGoYayo,1280
B4PkSVLbErg,I READ THEM LIKE A BOOK!!,10,790,2645,60,0,V0RT3X7355,499
9jJVLuUdbx8,QUE GOLAZO QUE HICE ⚽⚽  #shorts,17,1069,262,7,3,parz1val,589
BWwA_FFZYXc,INSANE air control skills from Accro vs SK GAMING ⚡️,16,1252,100,3,0,WYLDE,1230
PdpwlJDDWp0,24 Minutes of UNBELIEVABLE Pro League Aces! | R6 Siege,1456,54,10824,224,7,Rainbow6 Hub,198000
4Hgl1Gemlb4,Rate that wallbang in The comments,6,1076,1524,,7,Psxcyr6,27
oRiV8h9mt-Y,THERES NO WAY 😂😂😂,16,1009,370,20,11,Jp Ngb,4060
tjhT_1i5xIs,MY FIRST FLIP RESET | ROCKET LEAGUE,15,1156,1830,48,1,LetsGoYayo,1280
7sIMX8WgPog,Is this the perfect dribble | Rocket League,24,1098,915,25,2,LetsGoYayo,1280
l-dc1usNETE,Pinch RL #rocketleague #shorts,11,963,1546,47,1,TR_DIEGO_15 RAINBOW SIX SIEGE,307
FNPZM4HR1Xc,Clubhouse is good for us | Tom Clancy's Rainbow 6 Siege | PS5,1806,2,0,0,0,LetsPlaymitConnor ,81
WIxNjkGr0vs,SIDEMEN VS JYNXZI,4141,520,3640092,90310,1767,MoreSidemen,9420000
acHe2XQyxGs,Rainbow 6 siege ranked,7168,2421,78,5,0,ExoticMortal,421
DBl5rqi9xPw,MY BEST FLIP RESET | Rocket League,19,1151,658,16,1,LetsGoYayo,1280
bH9F0SgyIzA,MELHORES MOMENTOS DE RAINBOW SIX SIEGE E ROCKET LEAGUE,414,2019,187,33,0,PUMPED BY PEPINO,157
iUbPHHFWP-A,Rainbow Six Siege Song | Rainbows In The Dark | #NerdOut ft Rockit Music,277,3599,46070973,554672,26826,NerdOut!,3380000
iS90K1H1F1w,BREEZI 😁🤣,16,1212,198,12,1,Classified Clips,1060
O9VQE8ejSkM,Nice,10,1011,1617,25,1,Chrizz,559
CcDFDupYg8g,IM RETIRING FROM ROCKET LEAGUE... #shorts,28,80,64227,871,8,Ricci Live,28300
VEvVCd49njM,Siege Clips #215 #shorts #streamer #ttv #twitch #rocketleague,8,1121,1134,17,0,Cruisey,438
_RoIJv-JyWU,MY FIRST CEILING MUSTY | Rocket League,10,1154,796,19,6,LetsGoYayo,1280
njksInSsj28,"Not sure how I'm the Assister on that one, but I'll accept it still. Game Tie.",22,1003,370,,0,Elated Gamer,26
qy0t9SvSbbQ,TOP 60+ SMARTEST MOMENTS IN R6 PRO LEAGUE HISTORY...,1037,313,240750,2921,42,Rainbow6 Hub,198000
U7nD7QEzib4,They need to do something about these cheaters 🥱🥱🥱 | Rainbow Six Siege #gaming  #r6 #shorts #twitch,16,606,6452,133,8,obgm_,497
hgDAIgP6tgQ,Casually Breaking R6 #rainbowsixsiege #seige #r6 #shorts,11,1401,959,11,1,BiscuitMan02,342
Y5T6Qtn3mhE,NOWS MY TIME | Rocket League,11,1128,9696,178,11,LetsGoYayo,1280
ogeLRWZ0vxk,OP solo Mute strat on Oregon #r6 #rainbowsixsiege #r6siege,52,240,907344,49382,307,AMHR6,17500
2k5IY-i-GOY,Yeah...That's normal around here🤣🤣🤣,19,1214,2320,79,7,Classified Clips,1060
MsiqbIVLrA4,FIRST DOUBLE TAP!!!! #shorts,16,1430,1626,118,5,HeNriKa,52
viPTBKYSDCk,Die Verwirrung ist verwirrt 😂😂,18,888,795,9,1,Sinclear,201
1qLv6ssvYRI,#cronus #r6,13,159,13184,206,27,Juhkobe,1600
PiOip9GrQsY,I Passed To My Opponent To Score,16,738,4637,82,5,Drew,40
_NNL7iNZq8o,perfect pass lol,11,1005,1722,27,1,Venmitz,507
6-29Ywl0XFs,"#3 FUNNY MOMENTS+FAILS IN RAINBOW SIX SIEGE-PS4(and rocket league,NBA)",316,1740,119,20,13,edutbx,438
uOwoK3yfr6w,R6 XIM APEX PS5,8,1096,4877,,15,Chunnid,42
EPSIUxZWUBQ,I CHOKED IT AWAY | Rocket League,10,1065,5782,123,6,LetsGoYayo,1280
ODzHC_WlGuM,You Have Friendly Auto Aim,6,27,48184,1122,28,CeeloCeelo,7690
xDDW61VKM2Q,Clutching w/ Valk In Champ Ranked #rainbowsixsiege #gaming #r6siege #rainbowsixsiege #rainbow6 #r6,12,372,8423,344,38,Reiding,83
3SMUDQZvA2k,PS4 Rainbow Six Siege/Rocket League (German) Road to 700 Sub`s,16792,2959,526,28,7,No Gravity e-Sports e.V.,907
pkENIMHbMBg,Third Match of the Diamond Tourney,32,1062,3409,53,1,LilDaveyJones,132
5711SvFWjCQ,The BEST #1 CHAMPION CLUTCHING Every Round on Operation TWIN SHELLS Rainbow Six Siege PS5/XBOX,633,359,634001,5706,186,Booelol,89300
AS7yh1JPno8,How to GET OUT of SILVER-Rocket League,33,1772,1078865,18192,516,MitchellSancier,42000
hE7aCFo7UBg,ITS MY TIME TO SHINE | Rocket League,12,1154,5131,143,2,LetsGoYayo,1280
lDE3si3L1rM,Want to Play R6S Competitively? Team Anthem #shorts,35,1037,413,12,2,Team Anthem,99
wFfSe3RsB5Q,BLAST R6 | South America League 2025 - Stage 1 - Day 6,24456,112,32167,340,11,Rainbow Six Esports,1420000
t4gdf6Fu370,BLAST R6 | North America League 2025 - Stage 2 - Day 1,28671,45,57981,848,49,Rainbow Six Esports,1420000
kBdIq-roXR0,CEILING SHOT MUSTY FLICK IS CLEAN | #rocketleague,10,1152,1411,31,11,LetsGoYayo,1280
wjDGfWJbs_s,I HIT THE FLIP RESET | Rocket league,8,1154,6257,146,9,LetsGoYayo,1280
Lzpsu6wRf48,Welcome To My Channel! (Rainbow 6 Siege Gameplay),214,3480,91,5,0,Electrz,96
odAGjWf9pS4,Lesion 3K! #rainbowsixsiege #rainbowsix #siege #twitch #r6 #r6siege #youtubeshorts #asmr #clutch,15,756,1481,17,2,OnyxOmg,8840
TaeYi53FA3g,PUT ME ON THE OFFENSIVE LINE COACH 😂,7,829,2094,35,2,Goalsey,282
N4uxtFmgW7M,Rainbow 6 Siege Montage #3,134,1371,61,7,2,The Pub Community,53
l-JuAcSAL5s,My first ace #r6siege #r6clutch,4,7,704,2,0,Crusher9811,126
ysdPtBZjOnM,NEW FLICK IN ROCKET LEAGUE!!(read description),14,1890,340027,7941,889,Cozzy,15400
1LBjQGUebVY,biggest Noob Rainbow Six Siege 😱 #gaming#viral#Rainbowsix#ps4#noob#shorts,10,1299,950,10,0,Revsnengns,137
RNsngKWWw9E,G2 Esports vs FaZe Clan | R6 Siege X at EWC 25 - Day 2 - Group Stage,5690,74,32506,404,36,Rainbow Six Esports Match Vods,59100
Ucqk8U9Utgg,R6 Siege X at EWC 25 // Semifinals - Day 4,22067,72,108882,1142,37,Rainbow Six Esports,1420000
MrylT3TG6Aw,2 crazy 1taps #r6 #r6siege #shorts #youtubeshorts #r6diamond #r6diamond #rainbowsixsiege #rainbow6,7,1102,5022,77,9,Zag YT,502
ag_-sH0fKJQ,🏎️ reaction time (full montage posted) #rainbowsixsiege #r6siege #gaming #siege #rainbowsix #r6,13,499,9715,237,55,Elimz,1310
Xi_8XNmLGic,Did not expected this Rank |Rocket League 3v3 | PS5,591,10,1,1,2,LetsPlaymitConnor ,81
AqHUdfciE1Q,Rocket League Crashed So Rainbow IT IS! | Rainbow Six Siege Live | PS4,19380,2272,352,33,2,YOBLADE,2530
EsyF_ZYlRmA,Tom Clancy’s Rainbow 6 Siege Loading Screen Part 2,20,1893,603,19,6,Loading Screens Gameplay,950
OEN_SBZkhcM,#rainbowsixsiege #r6siege #tomclanysrainbowsixsiege #gaming #livestream,16,397,11674,278,17,miychl,570
qM3xqUs0lno,SSL Potato & SirPineapple Play Siege,635,212,38042,1220,69,VNCE,98000
m7eQ2KTFBQs,"Mi Club KarMaCluB (con rainbow six siege, overwatch, rocket league y ww2)",399,2986,253,27,62,Ruben,1160
9OWUdefKZJY,Game of Ramming People | Rocket League 3v3 | PS5,823,11,1,1,2,LetsPlaymitConnor ,81
KHuFzwFp4zI,More Solo than in Team | Rocket League 3v3 | PS5,736,12,1,1,2,LetsPlaymitConnor ,81
54CBbNmXZnY,SPOIT 1V3 VS EVERY RANK IN SIEGE X (IMPOSSIBLE),2771,96,386212,6771,279,Spoit,1260000
xQdyH7Tsg2E,Path Shows His Rank Stack!,11,86,30817,325,51,Path,18800
rsJ9G0vb440,Best Flick In Rainbow Six Siege #r6siege #shorts,9,958,2305,39,16,Jake The Bob,502
BulPmoYg4eg,Lovely Matchmaking | Rocket League 3v3 | PS5,808,13,1,1,4,LetsPlaymitConnor ,81
aIdadTFdDXk,Ordinary Day on R6 🔥🔥🔥 #dinguerie #pourtoi #fps #onetap #r6 #tendance #valorant #rocketleague #csgo,10,983,372,4,0,Tanguy HERVE,15
CxJ27Cq-N3c,Can my Teammate and me Improve? | Rocket League 2v2 | PS5,945,20,2,1,2,LetsPlaymitConnor ,81
ocZVJ91cJuU,What can i do without my Mate? | Rocket League 2v2 | PS5,686,19,1,1,2,LetsPlaymitConnor ,81
d3jcPb0bmwc,Flawless Victory | Tom Clancy’s Rainbow 6 Siege| PS5,1225,21,4,1,0,LetsPlaymitConnor ,81
GAfAN2GEkZA,I SOLD THE FLIP RESET | Rocket League,10,1157,5452,118,27,LetsGoYayo,1280
jyqAo6Rleak,These Clips Prove Jynxzi Is Actually INSANE at Rainbow Six Siege,526,207,480534,7610,231,Rainbow6 Hub,198000
hcDHzyqmYB0,Tom Clancy's Rainbow Six Siege head and shoulders |#Twitch #shorts #gaming,29,433,3214,17,11,Liger,155
fmQb6w5c9HM,quick match 3k #gaming #r6 #clips #rainbow6 #rainbowsix #shorts #fyp #gamer #clutch #rl #ytshorts,11,974,1369,40,2,Pig,23
PyldHUK-yvQ,Soon its time for my Rank! | Rocket League | PS5,831,18,2,0,0,LetsPlaymitConnor ,81
7Au4q2-1r9Y,"Funniest Moments (Rainbow six siege, Minecraft, ColdWar, Rocket league)",1148,1650,86,11,1,Datzjae,211
MerDrTMN3IA,FINALLY Using Air Roll Right,16,1188,954,19,2,Kokopelli Gaming,67
hkHoGDMDHWs,10 Games full of hate for 1v1 | Rocket league 1v1 | PS5,466,24,2,1,6,LetsPlaymitConnor ,81
kdA6cRPjsN8,The best tip for winning more 1v1's in R6,22,1223,79837,5201,63,Poxonlox,375000
LEX-ps6IJM8,#Rainbow6Siege #r6siege #R6 #Rainbow6 #R6S #gaming #fyp #fy #FPS #PC,7,1223,2480,46,8,SowlySLD,25
5X-FVC8aHP0,Wasted Wednesday - Rainbow 6 Siege & Rocket League,23118,3167,213,18,4,Proof,375
fbiqnOCC82Q,WHAT A SAVE | Rocket League,8,1148,5796,62,6,LetsGoYayo,1280
Ete14uiwAGU,They got VIOLATED in Ranked,24,672,2314,64,5,Gaboe-,12
V0f3O-FqBMA,"🎧ASMR Rocket League, Tingley Mouth Sounds + Fast Mouth Sounds🎧",382,1579,4145,72,14,Jibster Guides ,574
3kh1DlMOXck,"Shoot First, Die Last. #tiktok #rainbowsixsiege #shorts #rainbowsixsiege #r6 #pc #foryou #blowup",21,1009,660,15,0,InSaNeClIpZZ,29
0axjTejXGAs,I Carried Stompn in Rocket League (Top 100 2v2),60,385,2630,74,4,Sosa,3060
BG7VHqOFQyU,Rainbow 6 Siege Casual with Xero Shadek Tournament Details Ps4 720p60Fps,6280,3163,75,11,2,BlazinBigSpeech,699
ctSoRngi6T0,Leaking Oil 7 || rocket league,17,534,4657,110,22,JLoot,2240
3PKniBXJNlQ,Poor Opponents | Rocket League 4v4 | PS5,894,7,0,0,0,LetsPlaymitConnor ,81
nJ8oljWzjWk,Fuze Is Underrated In Rainbow Six Siege🔥 #rainbowsixsiege #r6siege #rainbowsixsiegerankedgameplay,60,401,14028,569,35,GamerL0rd,7970
7S286g0Z4K4,How this Hidden Shield Mechanic Completely BREAKS Siege #r6 #siege #esports #fettr6s,57,445,38990,2344,19,Fett Shorts,9670
nJ8oljWzjWk,Fuze Is Underrated In Rainbow Six Siege🔥 #rainbowsixsiege #r6siege #rainbowsixsiegerankedgameplay,60,401,14028,569,35,GamerL0rd,7970
7S286g0Z4K4,How this Hidden Shield Mechanic Completely BREAKS Siege #r6 #siege #esports #fettr6s,57,445,38990,2344,19,Fett Shorts,9670
VRC_U2VUHtM,That was rough | Rocket League 1v1 | PS5,692,26,4,1,4,LetsPlaymitConnor ,81
R0iIY7fCkbM,Caught That in 4K😂 R6 Siege #Shorts #Gaming,17,609,3900,60,5,Swirxo,215
GmXUQwSYEWE,Pure Domination | Rocket League 3v3 | PS5,774,14,2,1,1,LetsPlaymitConnor ,81
jyPJ1En_hjc,Остроумные шутки/ухахатбл/Rainbow six siege/Rocket League/Payday 2,784,2107,140,14,8,CIBZ,22
7hxh2JV4nBM,Lets Rank the Best Mode in Rocket League | Rocket League 2v2 | PS5,891,21,0,0,0,LetsPlaymitConnor ,81
rqr0-hkkn7E,que jugadon de tony rojas perez,59,894,348,14,0,Dark jham,207
BirqfYP_11A,RAINBOW SIX SIEGE Y9S3 NEW OPERATOR GAMEPLAY #rainbowsixsiege #r6siege #r6,10,424,21965,588,57,fnsnarco,1450
bBfCnQCOISg,Random Rocket League Bullshittery,528,2179,8139685,202476,7625,SovietWomble,4020000
i-U6FOrt1eM,Best Spawn Peek On Chalet Rainbow Six Siege || R6 Educational ||,15,558,10359,237,5,Ross,583
ORaFCwY8_Qs,G2 Esports vs Shopify Rebellion | R6 Siege X at EWC 25 - Day 1 - Group Stage,3115,76,20481,355,28,Rainbow Six Esports Match Vods,59100
GCKMZU0QgrU,WE DESTROYED THEM | Tom Clancy's Rainbow 6 Siege | PS5,1118,0,1,1,1,LetsPlaymitConnor ,81
GxBAGmPajN0,Beaulo.,73,139,18426,1043,47,Beaulo,1470000
Rht-MRbapaE,RAINBOW SIX SIEGE Full Movie Cinematic (2024) 4K ULTRA HD Action,1988,602,2290286,44246,1054,GameClips,5070000
Y28pw2iEQro,ROCKET LEAGUE REDEEM CODE 2025 😎 #shorts,37,94,171742,2168,56,Tyler Ham,69700
rQQ7vA45oJ0,The Finals But I'm Impatient #thefinals #impatient #quickcash,16,492,10549,280,4,X-spec40,56
lah7fT7pFJU,Hol up #gaming #6siege #rocketleague #r6champ #newstreamer #rainbowsixsiege #rainbowsixsiegeclip,19,531,10352,221,17,izick209,364
XbUDLgDtBhA,Siege X INSANE MOMENTS 🤯 (Pro League),632,110,52131,1111,20,Rainbow6 Hub,198000
CYKe5Y7Y5Bk,Lo Que Hemos Mejorado!!!😎💥✈️,33,928,1239,38,1,MEGamePlays,331
t0Z36t8iw8A,"USETE KLIP 8 - Rocket League, Hitman 2, RDR2, R6 Siege og Mere [Dansk]",658,2151,36320,775,63,Jannik I Spil,56600
xjhC2K_GcbM,MOST NORMAL REACTION IN ROCKET LEAGUE.. #shorts,20,80,32052,988,25,Ricci Live,28300
_lqM-DTACIs,stößchen,8,962,581,,0,JohnnyBootica,569
m4YX_l1YxSs,I dont wanna be in bronze anymore | Tom Clancy's Rainbow 6 Siege | PS5,1882,7,2,1,1,LetsPlaymitConnor ,81
J4yi0Ty0qZw,LETS GET READY TO RUMBLE | Rocket League Rumble | PS5,746,0,0,0,0,LetsPlaymitConnor ,81
bFSg1LOyfhE,Dad guesses video game logos 20 🕹😂,32,0,2898,215,6,Doof,16600
X3eoYhTWflc,Copper To Champion Episode 2 (SIEGE X),8224,91,1092263,20452,1994,Jynxzi Live,1440000
yylhT1YlX74,Headshot 223 | A R6 Edit (Rainbow Six Siege) #r6siege #gaming #r6 #edit #r6edit,13,45,11305,185,27,Paco,2560
-1Lh6RPQnHg,How will i perform in 1v1? | Rocket League 1v1 | PS5,787,28,5,1,5,LetsPlaymitConnor ,81
5n_qH3uQTiQ,Spoit & Jynxzi vs Shaiiko & Sxnzoo 2v2 (Rainbow Six Siege),1559,421,941640,16912,477,Spoit,1260000
1rsrfMu7xkI,"rocket league et rainbow six siege: fun, drole enfin pas trop",6698,2033,98,1,0,Kilsme,21
ByuMxBgA2A4,🎧ASMR Rocket League Ranked🎧 Intense Mouth Sounds + Fast Mouth Sounds 😴~Chill Vibes~😴,410,1623,1186,23,3,Jibster Guides ,574
Uwx8q-LiGGI,VADO AVANTI - RAINBOW SIX SIEGE  #rainbowsixsiege #gaming #twitch #r6siege #clips #streamer,12,519,7305,283,4,Bstaaard,983000
wtTNKYiUu9k,ROCKET CYCLE,2798,7,740358,14436,444,Jynxzi Live,1440000
rI6vhr-epTc,He Got That 2-Piece Combo! 🍗 #r6s #rainbowsixsiegeclips #r6 #rainbow6siege #rainbowsixsiege,11,461,5269,152,2,Trondoxy,1430
YVcBRvjjDjk,EWC - R6 SIEGE X - QUARTAS DE FINAL - TODOS OS JOGOS - COMPLETO,20504,73,16852,619,0,MADHOUSE TV,212000
Nj2Swq0J0-8,SPEEDRUNNING A BAN IN SIEGE X (NEW WORLD RECORD),2613,105,1392777,23511,842,Spoit,1260000
KIy8dFPFuAM,how to fix matchmaking error/glitch 2025 (Rainbow six siege x),80,120,4499,62,4,Gabeyary,24
lvWbNuOBVws,INSANE MOMENTS SIEGE X PRO LEAGUE⭐ (2025),583,104,16427,397,8,Rainbow6 Hub,198000
XJzLkrjiwPk,“I am my perimeter” ahhhhhh video #rainbowsixsiege #6siege #champion #siege,14,553,6235,193,5,Iceland50pbag Clips,99
HYiib4JOKMA,R6 NEW Ranked CHARMS! #rainbowsixsiege #r6siege #r6,31,510,6561,125,27,SacredSilvers,493
AoYw51z-Fvs,SSL Potato x SirPineapple,57,218,12348,1073,8,VNCE,98000
AJK702ILBdU,BLAST R6 | North America League 2025 - Stage 1 - Playoffs Day 4,23926,92,86585,992,34,Rainbow Six Esports,1420000
kEbT70kS5TU,SPOIT VS THE OLDEST CHAMPION 1V1 (Rainbow Six Siege),2825,166,359101,8520,348,Spoit,1260000
yzxl6ww5Yi4,Stompn is Back with Rocket League | The King Returns to Dominate,3815,52,3846,899,8,Stompn G2 R6,3270
0uk_LTuN-s4,Best R6 CONSOLE SETTINGS for OPERATION TWIN SHELLS 🐚,33,404,18878,696,40,vZenful,7440
TKNHEkKiQEE,Playing RANKED R6 Siege With a Nintendo POWER GLOVE!,1121,2492,948919,38882,3347,Basically Homeless,2100000
pulIXn_nKjg,*BEST* Controller Settings = NO RECOIL 🎮🏆 #shorts #rainbowsixsiege #r6siege #bestcontrollersettings,47,206,9911,308,83,iiMqko,5860
FmcsRWQ7DQw,The new R6 hop out song #gameplay #gaming #music #kendricklamar #rainbowsixsiege #ranked #subscribe,15,326,9209,478,27,Catchumzzz,719
6CfYlBOLP44,EWC - R6 SIEGE X - SEMIFINAIS - TODOS OS JOGOS - COMPLETO,18453,72,15097,494,0,MADHOUSE TV,212000
5erWjlD6O-c,How To Get Battle Bus Car Body For FREE! (Fortnite Rocket League),61,123,46792,935,41,Brani,735000
SDdcMp3ZK10,I Let AI Choose My Sensitivity.. (Rainbow Six Siege),2617,89,50006,878,46,Ricci,135000
hqDGxCLZoO8,Dad guesses video game logos 18 🕹😂,51,2,25457,1672,52,Doof,16600
jJZuwels7U0,Soldiers Used Giant Cones To Hear Planes 😮,39,9,10898957,569620,2137,Zack D. Films,24000000
_XwqLANol18,EWC - R6 SIEGE X - DIA 2 - TODOS OS JOGOS - COMPLETO,21480,74,14772,508,1,MADHOUSE TV,212000
IerowNLiUAg,Battlefield 6 Live - Levelling Snipers and AR's | Conquest 64,20061,2,17,0,0,[ZND] The DBZ_KING7,386
ALpE4txuE5E,Tom sneezes,6,3438,51,1,0,barnzYT,57
MVzsObYvHDo,Battlefield 6 has a huge problem!,54,7,220497,7704,1755,Tdawgsmitty,556000
LZeU50a87bo,EWC - R6 SIEGE X - DIA 1 - TODOS OS JOGOS - COMPLETO,35167,75,14105,534,1,MADHOUSE TV,212000
q8IxShwa4To,ONSIDE KICK RETURN TOUCHDOWN! Online Madden 26 Dolphins Bengals,26,5,61,0,0,Doug E,283
TufcT2Q4w20,Gaming Highlights 218 (Call of Duty: Black Ops 7 BETA),259,5,22,2,2,Doug E,283
vAZl3M5IyyI,Skytech King 95 Review: Ryzen 7 7800X3D + RX 9070XT Beast for 4K Gaming! | Review Orientation,119,2,6,0,0,Reviewbuz25,11
f8rG2IYKSS0,Dad guesses video game logos 17 🕹😂,44,3,14063,1015,14,Doof,16600
r2kcvvW9ZvI,هل يستحق هذا المايك كل هذا الضجيج؟ 🎤,281,13,222,12,14,هاني HaNii I,2050
zMotz5lQ4LA,Dad guesses video game logos 19 🕹😂,51,1,23776,2009,21,Doof,16600
nZsX5z2i9ko,His Father Was Surprised Because He Sold His House And Spent All The Money Buying Useless Things,98796,2,9455,274,27,Recap Manga,66900
paZOTUnAe0A,R6::MondayBlues,701,2169,2,122,0,BooTV (Al Iqbal),88
prgVOYIjylg,"Crackers are costly so playing games || Valorant India Live || Battlefield 6 || Telugu, Hin, Eng.",0,0,48,14,0,Sly Sai,444
U-nmLgbPXF8,"🔥 FREE Steam Account Games! 🎮 GTA5, RDR2 Cyberpunk2077 ⚡ 100% Working 2025 #FreeGames #Steam",25,2,169,6,10,Not Boy Gaming ,86
rQ2YNk_R9Wc,【MULTI SUB】一口气爽看韩漫《全职觉醒》,4128,4,3035,34,3,幻彩動漫解說閣,55700
R931fsP3GZU,jenny diane asi keaton - we go up 🩷,7,7,76394,3566,231,Automotive Star,808000
pVPmcfc6RaA,victoria secret 🩷,15,3,14977,511,31,Automotive Star,808000
-Z10hfTSua8,🎮 Кто-то чилит… а кто-то играет в соревновательные игры 😭,12,2,3317,94,3,Geek Sasha ,2030
CNMF2oKxmC4,【MULTI SUB】一口气看爽韩漫《全职觉醒》,4128,4,971,12,0,韩漫潮映馆,32000
7JBIV4K033o,"All Xbox, Nintendo and PlayStation Startups (Switch 2 + Unused Brand ID)",427,201,194149,1500,123,Game Domain,79000
SVKTgKtVjcs,Ranking The Consoles!,22,223,35081,2003,154,More1980sGamer,267000
Y2YB9PmmxAw,PlayStation 5 vs Nintendo Switch,16,220,1492722,74597,723,1980sGamer,1780000
1j2alOWI_DM,Nintendo Switch 2 vs. Xbox Series X & PS5,9,271,2604746,23184,1667,Pediagames,7330
Dq3qF_xp43s,Choose ONE: PlayStation vs. Xbox vs Nintendo,13,423,33592,415,37,trick-dis,1390
7ki4s51YoZA,What is the Best Gaming Console? (PS5 vs Xbox Series X vs Nintendo Switch),354,870,293286,2827,972,MikMat Tech,3670
VUwMm-2pfvo,PlayStation 5 vs Nintendo Switch,12,689,521172,16166,1859,1980sGamer,1780000
RZvrfFiozfQ,What's the BEST gaming system? 🤔 PlayStation vs Xbox Vs Nintendo Switch vs PC,26,1049,7535333,,8110,Treadmill Guy,2530000
nqaXUG5EHaQ,PlayStation Xbox Nintendo,48,13,1209,22,0,Andy stoky thé rétro gaming,19
UMyqdHOWIFA,PlayStation vs Nintendo vs Xbox | Game Console Wars 2002-2023 | Monthly Sales,489,885,2382410,17455,1965,Gozhda,121000
VVWvkGP_K7Y,"Xbox, Nintendo, or PlayStation?",34,950,1482867,83258,4119,ZackScottGames,5500000
RtIB1h8jvfw,"All Xbox, Nintendo, PlayStation & Sega Startups (Switch 2 + Unused Brand ID)",774,190,1235037,9203,615,Game Domain,79000
Qq-QpAY5AMQ,Nintendo Switch vs. PlayStation Portal!,30,174,9032461,143830,770,EmSwizzle,1930000
IDct11-EY4o,$10 vs $500 Nintendo Switch!,30,358,12525110,219684,978,EmSwizzle,1930000
FA_uS4nMvtA,Video Game Console Drop Test - Xbox Vs Playstation Vs Nintendo Vs Sega | WIRED’s Battle Damage,638,3869,2658660,25196,5497,WIRED,12500000
-D-J2pXHJp4,PlayStation vs Xbox Button Layouts,19,101,1099322,37076,317,1980sGamer,1780000
4EHXHXrR74o,Which team are You?(update) #controllers #nintendo #xbox #playstation #pc #sega #retrogaming #gaming,6,123,656308,4191,861,Pixel Up,10400
syqh8pa98ZE,Why does the Nintendo Switch outsell Xbox and PlayStation? 🤔,37,628,3483523,193532,6164,Garett,697000
GSWsTohY0PA,PLAYSTATION 6 vs Next Gen XBOX #shorts,60,125,23067993,794802,20166,jacobweeby,2050000
dthVt-tCWKA,What Is Your Favorite Controller ?#controller #playstation #xbox #nintendo #gaming #retrogaming,5,146,3469817,15131,1254,Pixel Up,10400
aAYjzMTW614,The Biggest and Smallest Retro Consoles at DKOldies? #nintendo #xbox #playstation,25,568,186457,9899,134,DKOldies.com,1800000
BCH7eIdUekY,Upgrading from PlayStation to XBOX,22,252,746945,43577,423,1980sGamer,1780000
Lr30YTXr1dY,Game Console Button Layouts,20,211,23454274,571307,2915,1980sGamer,1780000
cJeG9Z1c4Bc,This is the coolest affordable gaming console of 2024 💝,14,314,1218955,13696,573,Arcade Boy Shop,5700
uqtfKGQzauc,The best console #gaming #xbox #playstation,17,542,396890,23344,1603,Rickster2344,1510000
yuxTVnBQ9DA,POPULAR GAMING CONSOLES in LEGO...,484,318,2180090,13925,770,MKMBrick,340000
tzGEY7szvkg,Hierarquia dos Consoles em 2025 #games #nintendo #playstation #xbox,5,184,691825,6585,1369,Guijerno Bigodon,4660
alcRsH9-gHI,wii xbox360 ps3 vs xbox series x PlayStation 5 Nintendo switch xbox series s,6,911,32436,517,36,dr Niall,172
-4_OaxOwqes,Sony PlayStation 3 vs Nintendo Wii,19,772,3049843,164352,1493,1980sGamer,1780000
W3FWsBL8jUg,Hierarquia dos Consoles Portáteis em 2025 #games #nintendo #sony #xbox,5,173,1251155,10338,668,Guijerno Bigodon,4660
pBLXwYRQCII,PS5 vs Xbox Series X ...,30,1046,8225801,297235,9716,SpawnPoiint,1150000
Uli53bO3ly4,TOP 10 Best Selling Video Game Consoles Of All Time! #shorts #videogames #nintendo #playstation,60,489,2302510,136595,1588,Makeshift Project,2250000
UKet7CCq_Hc,RANKING OLD VIDEO GAME CONSOLES! Which Is Best? #shorts #videogame #ranking #playstation #nintendo,59,368,2386649,65729,2887,Makeshift Project,2250000
MqVi2KuJwlg,I bought EVERY Nintendo Console!,60,689,6167829,331153,3174,Mrwhosetheboss,21800000
uj9fmnGCIwM,Nintendo Switch 2 VS Rog Xbox Ally X #nintendo #nintendoswitch #switch #switch2 #trending #shorts,10,108,514095,,1026,Amarok Senthor,43400
7ndyNeZZSJI,"The Forgotten $300,000 Game Console😳",36,313,86980,4394,83,Worldly Past,54200
6_oLK098650,Nintendo Switch 2 vs. PS5!,30,192,12785931,187281,795,EmSwizzle,1930000
XuV083Aj3yE,PS5 vs SWITCH OLED 😱 #shorts #ps5 #switcholed #comedia,17,1436,14946477,479153,2144,PUCKY PACHECO,8230000
Eab1GjqxDTo,Video game Controller Evolution [1985-2020] #asmr #videogames #ps1 #xbox #nintendo #retrogaming,54,292,1786197,40331,378,Saturn ASMR,108000
